,abstract,authors,date,title,title-de,title-zh,url
46,"The increasing complexity of AI systems has made understanding their behavior critical. Numerous interpretability methods have been developed to attribute model behavior to three key aspects: input features, training data, and internal model components, which emerged from explainable AI, data-centric AI, and mechanistic interpretability, respectively. However, these attribution methods are studied and applied rather independently, resulting in a fragmented landscape of methods and terminology. This position paper argues that feature, data, and component attribution methods share fundamental similarities, and a unified view of them benefits both interpretability and broader AI research. To this end, we first analyze popular methods for these three types of attributions and present a unified view demonstrating that these seemingly distinct methods employ similar techniques (such as perturbations, gradients, and linear approximations) over different aspects and thus differ primarily in their perspectives rather than techniques. Then, we demonstrate how this unified view enhances understanding of existing attribution methods, highlights shared concepts and evaluation criteria among these methods, and leads to new research directions both in interpretability research, by addressing common challenges and facilitating cross-attribution innovation, and in AI more broadly, with applications in model editing, steering, and regulation.","Shichang Zhang, Tessa Han, Usha Bhalla, Himabindu Lakkaraju",2025-05-29T16:49:00Z,"Towards Unified Attribution in Explainable AI, Data-Centric AI, and   Mechanistic Interpretability","Auf dem Weg zu einer einheitlichen Attribution in erklärbarer KI, datenzentraler KI und mechanistischer Interpretierbarkeit",实现可解释的AI、数据集中AI和机械可解释性的统一归属,http://arxiv.org/abs/2501.18887v3
47,"Graph Bayesian optimization (BO) has shown potential as a powerful and data-efficient tool for neural architecture search (NAS). Most existing graph BO works focus on developing graph surrogates models, i.e., metrics of networks and/or different kernels to quantify the similarity between networks. However, the acquisition optimization, as a discrete optimization task over graph structures, is not well studied due to the complexity of formulating the graph search space and acquisition functions. This paper presents explicit optimization formulations for graph input space including properties such as reachability and shortest paths, which are used later to formulate graph kernels and the acquisition function. We theoretically prove that the proposed encoding is an equivalent representation of the graph space and provide restrictions for the NAS domain with either node or edge labels. Numerical results over several NAS benchmarks show that our method efficiently finds the optimal architecture for most cases, highlighting its efficacy.","Yilin Xie, Shiqiang Zhang, Jixiang Qing, Ruth Misener, Calvin Tsay",2025-05-29T16:46:29Z,Global optimization of graph acquisition functions for neural   architecture search,Globale Optimierung von Graphen-Erfassungsfunktionen für die neuronale Architektursuche,全球优化用于神经结构搜索的图图获取功能,http://arxiv.org/abs/2505.23640v1
48,"Decomposing hard problems into subproblems often makes them easier and more efficient to solve. With large language models (LLMs) crossing critical reliability thresholds for a growing slate of capabilities, there is an increasing effort to decompose systems into sets of LLM-based agents, each of whom can be delegated sub-tasks. However, this decomposition (even when automated) is often intuitive, e.g., based on how a human might assign roles to members of a human team. How close are these role decompositions to optimal? This position paper argues that asymptotic analysis with LLM primitives is needed to reason about the efficiency of such decomposed systems, and that insights from such analysis will unlock opportunities for scaling them. By treating the LLM forward pass as the atomic unit of computational cost, one can separate out the (often opaque) inner workings of a particular LLM from the inherent efficiency of how a set of LLMs are orchestrated to solve hard problems. In other words, if we want to scale the deployment of LLMs to the limit, instead of anthropomorphizing LLMs, asymptotic analysis with LLM primitives should be used to reason about and develop more powerful decompositions of large problems into LLM agents.","Elliot Meyerson, Xin Qiu",2025-05-29T16:46:00Z,Position: Scaling LLM Agents Requires Asymptotic Analysis with LLM   Primitives,Position: Skalierung von LLM-Agenten erfordert asymptotische Analyse mit LLM-Primitiven,位置: 缩放 LLM 代理需要用 LLM 原始功能进行抗药性分析,http://arxiv.org/abs/2502.04358v2
49,"The model context protocol (MCP) has been widely adapted as an open standard enabling the seamless integration of generative AI agents. However, recent work has shown the MCP is susceptible to retrieval-based ""falsely benign"" attacks (FBAs), allowing malicious system access and credential theft, but requiring that users download compromised files directly to their systems. Herein, we show that the threat model of MCP-based attacks is significantly broader than previously thought, i.e., attackers need only post malicious content online to deceive MCP agents into carrying out their attacks on unsuspecting victims' systems.   To improve alignment guardrails against such attacks, we introduce a new MCP dataset of FBAs and (truly) benign samples to explore the effectiveness of direct preference optimization (DPO) for the refusal training of large language models (LLMs). While DPO improves model guardrails against such attacks, we show that the efficacy of refusal learning varies drastically depending on the model's original post-training alignment scheme--e.g., GRPO-based LLMs learn to refuse extremely poorly. Thus, to further improve FBA refusals, we introduce Retrieval Augmented Generation for Preference alignment (RAG-Pref), a novel preference alignment strategy based on RAG. We show that RAG-Pref significantly improves the ability of LLMs to refuse FBAs, particularly when combined with DPO alignment, thus drastically improving guardrails against MCP-based attacks.",John Halloran,2025-05-29T16:44:29Z,MCP Safety Training: Learning to Refuse Falsely Benign MCP Exploits   using Improved Preference Alignment,"MCP Safety Training: Lernen, falsch benachbarte MCP-Exploits mit verbesserter Präferenzausrichtung abzulehnen","MCP 安全培训:学会利用改进的优惠协调,错误拒绝 MCP 剥削",http://arxiv.org/abs/2505.23634v1
50,"Identifying mistakes (i.e., miscues) made while reading aloud is commonly approached post-hoc by comparing automatic speech recognition (ASR) transcriptions to the target reading text. However, post-hoc methods perform poorly when ASR inaccurately transcribes verbatim speech. To improve on current methods for reading error annotation, we propose a novel end-to-end architecture that incorporates the target reading text via prompting and is trained for both improved verbatim transcription and direct miscue detection. Our contributions include: first, demonstrating that incorporating reading text through prompting benefits verbatim transcription performance over fine-tuning, and second, showing that it is feasible to augment speech recognition tasks for end-to-end miscue detection. We conducted two case studies -- children's read-aloud and adult atypical speech -- and found that our proposed strategies improve verbatim transcription and miscue detection compared to current state-of-the-art.","Griffin Dietz Smith, Dianna Yee, Jennifer King Chen, Leah Findlater",2025-05-29T16:34:47Z,Prompting Whisper for Improved Verbatim Transcription and End-to-end   Miscue Detection,Prompting Whisper für verbesserte wörtliche Transkription und End-to-End-Missue-Erkennung,逐字记录和终端至终端杂项探测,http://arxiv.org/abs/2505.23627v1
51,"Training large language models (LLMs) models directly in low-precision offers a way to address computational costs by improving both throughput and energy efficiency. For those purposes, NVIDIA's recent Blackwell architecture facilitates very low-precision operations using FP4 variants. Yet, current algorithms for training LLMs in FP4 precision face significant accuracy degradation and often rely on mixed-precision fallbacks. In this paper, we investigate hardware-supported FP4 training and introduce a new approach for accurate, end-to-end FP4 training with all the major computations (i.e., linear layers) in low precision. Through extensive evaluations on Llama-type models, we reveal a new low-precision scaling law that quantifies performance trade-offs across bit-widths and training setups. Guided by this investigation, we design an ""optimal"" technique in terms of accuracy-vs-computation, called Quartet. We implement Quartet using optimized CUDA kernels tailored for Blackwell, demonstrating that fully FP4-based training is a competitive alternative to FP16 half-precision and to FP8 training. Our code is available at https://github.com/IST-DASLab/Quartet.","Roberto L. Castro, Andrei Panferov, Soroush Tabesh, Oliver Sieberling, Jiale Chen, Mahdi Nikdan, Saleh Ashkboos, Dan Alistarh",2025-05-29T16:32:48Z,Quartet: Native FP4 Training Can Be Optimal for Large Language Models,Quartett: Native FP4 Training kann für große Sprachmodelle optimal sein,四方:土著FFF4培训可以成为大语言模式的最佳方式,http://arxiv.org/abs/2505.14669v2
52,"Spiking Neural Networks (SNNs), as a biologically plausible alternative to Artificial Neural Networks (ANNs), have demonstrated advantages in terms of energy efficiency, temporal processing, and biological plausibility. However, SNNs are highly sensitive to distribution shifts, which can significantly degrade their performance in real-world scenarios. Traditional test-time adaptation (TTA) methods designed for ANNs often fail to address the unique computational dynamics of SNNs, such as sparsity and temporal spiking behavior. To address these challenges, we propose SPike-Aware Consistency Enhancement (SPACE), the first source-free and single-instance TTA method specifically designed for SNNs. SPACE leverages the inherent spike dynamics of SNNs to maximize the consistency of spike-behavior-based local feature maps across augmented versions of a single test sample, enabling robust adaptation without requiring source data. We evaluate SPACE on multiple datasets. Furthermore, SPACE exhibits robust generalization across diverse network architectures, consistently enhancing the performance of SNNs on CNNs (such as VGG and ResNet), Transformer models, and ConvLSTM architectures. Experimental results show that SPACE outperforms state-of-the-art methods, highlighting its effectiveness and robustness in real-world settings.","Xinyu Luo, Kecheng Chen, Pao-Sheng Vincent Sun, Chris Xing Tian, Arindam Basu, Haoliang Li",2025-05-29T16:30:38Z,SPACE: SPike-Aware Consistency Enhancement for Test-Time Adaptation in   Spiking Neural Networks,SPACE: SPike-Aware Consistency Enhancement für Test-Time-Anpassung in Spiking Neuronal Networks,空间:在Spiking神经网络中加强在测试-时间适应方面的SPike-Aware一致性增强,http://arxiv.org/abs/2504.02298v2
53,"We study the fundamental problem of estimating an unknown discrete distribution $p$ over $d$ symbols, given $n$ i.i.d. samples from the distribution. We are interested in minimizing the KL divergence between the true distribution and the algorithm's estimate. We first construct minimax optimal private estimators. Minimax optimality however fails to shed light on an algorithm's performance on individual (non-worst-case) instances $p$ and simple minimax-optimal DP estimators can have poor empirical performance on real distributions. We then study this problem from an instance-optimality viewpoint, where the algorithm's error on $p$ is compared to the minimum achievable estimation error over a small local neighborhood of $p$. Under natural notions of local neighborhood, we propose algorithms that achieve instance-optimality up to constant factors, with and without a differential privacy constraint. Our upper bounds rely on (private) variants of the Good-Turing estimator. Our lower bounds use additive local neighborhoods that more precisely captures the hardness of distribution estimation in KL divergence, compared to ones considered in prior works.","Jiayuan Ye, Vitaly Feldman, Kunal Talwar",2025-05-29T16:27:57Z,Instance-Optimality for Private KL Distribution Estimation,Instanz-Optimalität für private KL-Verteilungsabschätzung,私人 KL 分布分布估计的实情- 最佳度,http://arxiv.org/abs/2505.23620v1
54,"Recent advancements in Text-to-Speech (TTS) models, particularly in voice cloning, have intensified the demand for adaptable and efficient deepfake detection methods. As TTS systems continue to evolve, detection models must be able to efficiently adapt to previously unseen generation models with minimal data. This paper introduces ADD-GP, a few-shot adaptive framework based on a Gaussian Process (GP) classifier for Audio Deepfake Detection (ADD). We show how the combination of a powerful deep embedding model with the Gaussian processes flexibility can achieve strong performance and adaptability. Additionally, we show this approach can also be used for personalized detection, with greater robustness to new TTS models and one-shot adaptability. To support our evaluation, a benchmark dataset is constructed for this task using new state-of-the-art voice cloning models.","Neta Glazer, David Chernin, Idan Achituve, Sharon Gannot, Ethan Fetaya",2025-05-29T16:26:32Z,Few-Shot Speech Deepfake Detection Adaptation with Gaussian Processes,Wenig scharfe Rede Deepfake Detection Anpassung an Gaußsche Prozesse,Gaussian 过程的“深假探测”适应,http://arxiv.org/abs/2505.23619v1
55,"Effective video tokenization is critical for scaling transformer models for long videos. Current approaches tokenize videos using space-time patches, leading to excessive tokens and computational inefficiencies. The best token reduction strategies degrade performance and barely reduce the number of tokens when the camera moves. We introduce grounded video tokenization, a paradigm that organizes tokens based on panoptic sub-object trajectories rather than fixed patches. Our method aligns with fundamental perceptual principles, ensuring that tokenization reflects scene complexity rather than video duration. We propose TrajViT, a video encoder that extracts object trajectories and converts them into semantically meaningful tokens, significantly reducing redundancy while maintaining temporal coherence. Trained with contrastive learning, TrajViT significantly outperforms space-time ViT (ViT3D) across multiple video understanding benchmarks, e.g., TrajViT outperforms ViT3D by a large margin of 6% top-5 recall in average at video-text retrieval task with 10x token deduction. We also show TrajViT as a stronger model than ViT3D for being the video encoder for modern VideoLLM, obtaining an average of 5.2% performance improvement across 6 VideoQA benchmarks while having 4x faster training time and 18x less inference FLOPs. TrajViT is the first efficient encoder to consistently outperform ViT3D across diverse video analysis tasks, making it a robust and scalable solution.","Chenhao Zheng, Jieyu Zhang, Mohammadreza Salehi, Ziqi Gao, Vishnu Iyengar, Norimasa Kobori, Quan Kong, Ranjay Krishna",2025-05-29T16:25:35Z,"One Trajectory, One Token: Grounded Video Tokenization via Panoptic   Sub-object Trajectory","Eine Trajektorie, ein Token: Erdliche Video-Tokenisierung über panoptische Sub-Objekt-Trajektorie","一个轨迹, 一个 Token: 通过泛光子物件轨迹, 固定的视频轨迹",http://arxiv.org/abs/2505.23617v1
56,"The rapid increase in computing power and the ability to store Big Data in the infrastructure has enabled predictions in a large variety of domains by Machine Learning. However, in many cases, existing Machine Learning tools are considered insufficient or incorrect since they exploit only probabilistic dependencies rather than inference logic. Causal Machine Learning methods seem to close this gap. In this paper, two prevalent tools based on Causal Machine Learning methods are compared, as well as their mathematical underpinning background. The operation of the tools is demonstrated by examining their response to 18 queries, based on the IDEAL Household Energy Dataset, published by the University of Edinburgh. First, it was important to evaluate the causal relations assumption that allowed the use of this approach; this was based on the preexisting scientific knowledge of the domain and was implemented by use of the in-built validation tools. Results were encouraging and may easily be extended to other domains.","Nikolaos-Lysias Kosioris, Sotirios Nikoletseas, Gavrilis Filios, Stefanos Panagiotou",2025-05-29T16:25:14Z,Causal Machine Learning in IoT-based Engineering Problems: A Tool   Comparison in the Case of Household Energy Consumption,Kausales maschinelles Lernen in IoT-basierten Engineering-Problemen: Ein Tool-Vergleich im Fall des Haushaltsenergieverbrauchs,以木工工程问题为基础的因果机械学习:家庭能源消费工具比较,http://arxiv.org/abs/2505.12147v2
57,"Neural networks (NNs) achieve outstanding performance in many domains; however, their decision processes are often opaque and their inference can be computationally expensive in resource-constrained environments. We recently proposed Differentiable Logic Networks (DLNs) to address these issues for tabular classification based on relaxing discrete logic into a differentiable form, thereby enabling gradient-based learning of networks built from binary logic operations. DLNs offer interpretable reasoning and substantially lower inference cost.   We extend the DLN framework to supervised tabular regression. Specifically, we redesign the final output layer to support continuous targets and unify the original two-phase training procedure into a single differentiable stage. We evaluate the resulting model on 15 public regression benchmarks, comparing it with modern neural networks and classical regression baselines. Regression DLNs match or exceed baseline accuracy while preserving interpretability and fast inference. Our results show that DLNs are a viable, cost-effective alternative for regression tasks, especially where model transparency and computational efficiency are important.","Chang Yue, Niraj K. Jha",2025-05-29T16:24:18Z,Learning Interpretable Differentiable Logic Networks for Tabular   Regression,Learning Interpretable Differentiable Logic Networks for Tabular Regression,用于制表递减的可解释可解释逻辑网络,http://arxiv.org/abs/2505.23615v1
58,"Classical search algorithms have long underpinned modern artificial intelligence. In this work, we tackle the challenge of inference-time control in diffusion models -- adapting generated outputs to meet diverse test-time objectives -- using principles from classical search. We propose a general framework that orchestrates local and global search to efficiently navigate the generative space. It employs a theoretically grounded local search via annealed Langevin MCMC and performs compute-efficient global exploration using breadth-first and depth-first tree search. We evaluate our approach on a range of challenging domains, including planning, offline reinforcement learning, and image generation. Across all tasks, we observe significant gains in both performance and efficiency. These results show that classical search provides a principled and practical foundation for inference-time scaling in diffusion models. Project page at diffusion-inference-scaling.github.io.","Xiangcheng Zhang, Haowei Lin, Haotian Ye, James Zou, Jianzhu Ma, Yitao Liang, Yilun Du",2025-05-29T16:22:40Z,Inference-time Scaling of Diffusion Models through Classical Search,Inferenzzeit Skalierung von Diffusionsmodellen durch klassische Suche,通过古典搜索对传播模型进行传播的推断-时间缩放,http://arxiv.org/abs/2505.23614v1
59,"This paper proposes a family of permutation-invariant graph embeddings, generalizing the Skew Spectrum of graphs of Kondor & Borgwardt (2008). Grounded in group theory and harmonic analysis, our method introduces a new class of graph invariants that are isomorphism-invariant and capable of embedding richer graph structures - including attributed graphs, multilayer graphs, and hypergraphs - which the Skew Spectrum could not handle. Our generalization further defines a family of functions that enables a trade-off between computational complexity and expressivity. By applying generalization-preserving heuristics to this family, we improve the Skew Spectrum's expressivity at the same computational cost. We formally prove the invariance of our generalization, demonstrate its improved expressiveness through experiments, and discuss its efficient computation.","Armando Bellante, Martin Plávala, Alessandro Luongo",2025-05-29T16:18:01Z,The Generalized Skew Spectrum of Graphs,Das generalisierte Skew-Spektrum der Graphen,普通的Skew图象光谱,http://arxiv.org/abs/2505.23609v1
60,"The transition from traditional power grids to smart grids, significant increase in the use of renewable energy sources, and soaring electricity prices has triggered a digital transformation of the energy infrastructure that enables new, data driven, applications often supported by machine learning models. However, the majority of the developed machine learning models rely on univariate data. To date, a structured study considering the role meta-data and additional measurements resulting in multivariate data is missing. In this paper we propose a taxonomy that identifies and structures various types of data related to energy applications. The taxonomy can be used to guide application specific data model development for training machine learning models. Focusing on a household electricity forecasting application, we validate the effectiveness of the proposed taxonomy in guiding the selection of the features for various types of models. As such, we study of the effect of domain, contextual and behavioral features on the forecasting accuracy of four interpretable machine learning techniques and three openly available datasets. Finally, using a feature importance techniques, we explain individual feature contributions to the forecasting accuracy.","Carolina Fortuna, Gregor Cerar, Blaz Bertalanic, Andrej Campa, Mihael Mohorcic",2025-05-29T16:16:16Z,Data Model Design for Explainable Machine Learning-based Electricity   Applications,Datenmodell-Design für erklärbare maschinelle Learning-basierte Stromanwendungen,可解释机器学习用电力应用数据模型设计,http://arxiv.org/abs/2505.23607v1
61,"Unified generation models aim to handle diverse tasks across modalities -- such as text generation, image generation, and vision-language reasoning -- within a single architecture and decoding paradigm. Autoregressive unified models suffer from slow inference due to sequential decoding, and non-autoregressive unified models suffer from weak generalization due to limited pretrained backbones. We introduce Muddit, a unified discrete diffusion transformer that enables fast and parallel generation across both text and image modalities. Unlike prior unified diffusion models trained from scratch, Muddit integrates strong visual priors from a pretrained text-to-image backbone with a lightweight text decoder, enabling flexible and high-quality multimodal generation under a unified architecture. Empirical results show that Muddit achieves competitive or superior performance compared to significantly larger autoregressive models in both quality and efficiency. The work highlights the potential of purely discrete diffusion, when equipped with strong visual priors, as a scalable and effective backbone for unified generation.","Qingyu Shi, Jinbin Bai, Zhuoran Zhao, Wenhao Chai, Kaidong Yu, Jianzong Wu, Shuangyong Song, Yunhai Tong, Xiangtai Li, Xuelong Li, Shuicheng Yan",2025-05-29T16:15:48Z,Muddit: Liberating Generation Beyond Text-to-Image with a Unified   Discrete Diffusion Model,Muddit: Befreiende Generation jenseits von Text-zu-Bild mit einem Unified Discrete Diffusion Model,Muddit: 利用统一分解传播模型在文本到图像之外解放一代,http://arxiv.org/abs/2505.23606v1
