,abstract,authors,date,title,title-de,title-zh,url
62,"Large language model (LLM)-based agents have shown promise in tackling complex tasks by interacting dynamically with the environment. Existing work primarily focuses on behavior cloning from expert demonstrations or preference learning through exploratory trajectory sampling. However, these methods often struggle to address long-horizon tasks, where suboptimal actions accumulate step by step, causing agents to deviate from correct task trajectories. To address this, we highlight the importance of timely calibration and the need to automatically construct calibration trajectories for training agents. We propose Step-Level Trajectory Calibration (STeCa), a novel framework for LLM agent learning. Specifically, STeCa identifies suboptimal actions through a step-level reward comparison during exploration. It constructs calibrated trajectories using LLM-driven reflection, enabling agents to learn from improved decision-making processes. We finally leverage these calibrated trajectories with successful trajectories for reinforced training. Extensive experiments demonstrate that STeCa significantly outperforms existing methods. Further analysis highlights that timely calibration enables agents to complete tasks with greater robustness. Our code and data are available at https://github.com/WangHanLinHenry/STeCa.","Hanlin Wang, Jian Wang, Chak Tou Leong, Wenjie Li",2025-05-29T16:13:21Z,STeCa: Step-level Trajectory Calibration for LLM Agent Learning,STeCa: Schritt-Level-Trajektorienkalibrierung für LLM Agent Learning,STeCa:LLM代理学习的职级轨迹校准,http://arxiv.org/abs/2502.14276v2
63,"Many modern learning tasks require models that can take inputs of varying sizes. Consequently, dimension-independent architectures have been proposed for domains where the inputs are graphs, sets, and point clouds. Recent work on graph neural networks has explored whether a model trained on low-dimensional data can transfer its performance to higher-dimensional inputs. We extend this body of work by introducing a general framework for transferability across dimensions. We show that transferability corresponds precisely to continuity in a limit space formed by identifying small problem instances with equivalent large ones. This identification is driven by the data and the learning task. We instantiate our framework on existing architectures, and implement the necessary changes to ensure their transferability. Finally, we provide design principles for designing new transferable models. Numerical experiments support our findings.","Eitan Levin, Yuxin Ma, Mateo Díaz, Soledad Villar",2025-05-29T16:12:49Z,On Transferring Transferability: Towards a Theory for Size   Generalization,Übertragbarkeit: Auf dem Weg zu einer Theorie der Größenverallgemeinerung,关于转让可转让性:走向一个通用规模理论,http://arxiv.org/abs/2505.23599v1
64,"This paper investigates the ability of large language models (LLMs) to recognise and solve tasks which have been obfuscated beyond recognition. Focusing on competitive programming and benchmark tasks (LeetCode and MATH), we compare performance across multiple models and obfuscation methods, such as noise and redaction. We demonstrate that all evaluated LLMs can solve tasks obfuscated to a level where the text would be unintelligible to human readers, and does not contain key pieces of instruction or context. We introduce the concept of eager pattern matching to describe this behaviour, which is not observed in tasks published after the models' knowledge cutoff date, indicating strong memorisation or overfitting to training data, rather than legitimate reasoning about the presented problem. We report empirical evidence of distinct performance decay patterns between contaminated and unseen datasets. We discuss the implications for benchmarking and evaluations of model behaviour, arguing for caution when designing experiments using standard datasets. We also propose measuring the decay of performance under obfuscation as a possible strategy for detecting dataset contamination and highlighting potential safety risks and interpretability issues for automated software systems.","Radzim Sendyka, Christian Cabrera, Andrei Paleyes, Diana Robinson, Neil Lawrence",2025-05-29T16:11:18Z,LLM Performance for Code Generation on Noisy Tasks,LLM-Performance für Code-Generierung bei lauten Aufgaben,LLM 噪音任务代码生成的LLM性能,http://arxiv.org/abs/2505.23598v1
65,"Multilook coherent imaging is a widely used technique in applications such as digital holography, ultrasound imaging, and synthetic aperture radar. A central challenge in these systems is the presence of multiplicative noise, commonly known as speckle, which degrades image quality. Despite the widespread use of coherent imaging systems, their theoretical foundations remain relatively underexplored. In this paper, we study both the theoretical and algorithmic aspects of likelihood-based approaches for multilook coherent imaging, providing a rigorous framework for analysis and method development. Our theoretical contributions include establishing the first theoretical upper bound on the Mean Squared Error (MSE) of the maximum likelihood estimator under the deep image prior hypothesis. Our results capture the dependence of MSE on the number of parameters in the deep image prior, the number of looks, the signal dimension, and the number of measurements per look. On the algorithmic side, we employ projected gradient descent (PGD) as an efficient method for computing the maximum likelihood solution. Furthermore, we introduce two key ideas to enhance the practical performance of PGD. First, we incorporate the Newton-Schulz algorithm to compute matrix inverses within the PGD iterations, significantly reducing computational complexity. Second, we develop a bagging strategy to mitigate projection errors introduced during PGD updates. We demonstrate that combining these techniques with PGD yields state-of-the-art performance. Our code is available at https://github.com/Computational-Imaging-RU/Bagged-DIP-Speckle.","Xi Chen, Soham Jana, Christopher A. Metzler, Arian Maleki, Shirin Jalali",2025-05-29T16:07:19Z,Multilook Coherent Imaging: Theoretical Guarantees and Algorithms,Multilook Coherent Imaging: Theoretische Garantien und Algorithmen,多视相协调成像:理论保障和理算,http://arxiv.org/abs/2505.23594v1
66,"Post-training of foundation language models has emerged as a promising research domain in federated learning (FL) with the goal to enable privacy-preserving model improvements and adaptations to user's downstream tasks. Recent advances in this area adopt centralized post-training approaches that build upon black-box foundation language models where there is no access to model weights and architecture details. Although the use of black-box models has been successful in centralized post-training, their blind replication in FL raises several concerns. Our position is that using black-box models in FL contradicts the core principles of federation such as data privacy and autonomy. In this position paper, we critically analyze the usage of black-box models in federated post-training, and provide a detailed account of various aspects of openness and their implications for FL.","Nikita Agrawal, Simon Mertel, Ruben Mayer",2025-05-29T16:04:39Z,Position: Federated Foundation Language Model Post-Training Should Focus   on Open-Source Models,Position: Federated Foundation Language Model Nachschulung sollte sich auf Open-Source-Modelle konzentrieren,立场:联邦基金会语文示范培训后培训应侧重于开放来源模式,http://arxiv.org/abs/2505.23593v1
67,"This paper explores second-order optimization methods in Federated Learning (FL), addressing the critical challenges of slow convergence and the excessive communication rounds required to achieve optimal performance from the global model. While existing surveys in FL primarily focus on challenges related to statistical and device label heterogeneity, as well as privacy and security concerns in first-order FL methods, less attention has been given to the issue of slow model training. This slow training often leads to the need for excessive communication rounds or increased communication costs, particularly when data across clients are highly heterogeneous. In this paper, we examine various FL methods that leverage second-order optimization to accelerate the training process. We provide a comprehensive categorization of state-of-the-art second-order FL methods and compare their performance based on convergence speed, computational cost, memory usage, transmission overhead, and generalization of the global model. Our findings show the potential of incorporating Hessian curvature through second-order optimization into FL and highlight key challenges, such as the efficient utilization of Hessian and its inverse in FL. This work lays the groundwork for future research aimed at developing scalable and efficient federated optimization methods for improving the training of the global model in FL.","Mrinmay Sen, Sidhant R Nair, C Krishna Mohan",2025-05-29T16:00:34Z,Accelerated Training of Federated Learning via Second-Order Methods,Beschleunigte Ausbildung des Föderierten Lernens über Methoden der zweiten Ordnung,通过二级方法加快联邦学习培训,http://arxiv.org/abs/2505.23588v1
68,"In medical image segmentation, limited external validity remains a critical obstacle when models are deployed across unseen datasets, an issue particularly pronounced in the ultrasound image domain. Existing solutions-such as domain adaptation and GAN-based style transfer-while promising, often fall short in the medical domain where datasets are typically small and diverse. This paper presents a novel application of principal component analysis (PCA) to address this limitation. PCA preprocessing reduces noise and emphasizes essential features by retaining approximately 90\% of the dataset variance. We evaluate our approach across six diverse breast tumor ultrasound datasets comprising 3,983 B-mode images and corresponding expert tumor segmentation masks. For each dataset, a corresponding dimensionality reduced PCA-dataset is created and U-Net-based segmentation models are trained on each of the twelve datasets. Each model trained on an original dataset was inferenced on the remaining five out-of-domain original datasets (baseline results), while each model trained on a PCA dataset was inferenced on five out-of-domain PCA datasets. Our experimental results indicate that using PCA reconstructed datasets, instead of original images, improves the model's recall and Dice scores, particularly for model-dataset pairs where baseline performance was lowest, achieving statistically significant gains in recall (0.57 $\pm$ 0.07 vs. 0.70 $\pm$ 0.05, $p = 0.0004$) and Dice scores (0.50 $\pm$ 0.06 vs. 0.58 $\pm$ 0.06, $p = 0.03$). Our method reduced the decline in recall values due to external validation by $33\%$. These findings underscore the potential of PCA reconstruction as a safeguard to mitigate declines in segmentation performance, especially in challenging cases, with implications for enhancing external validity in real-world medical applications.","Christian Schmidt, Heinrich Martin Overhoff",2025-05-29T15:59:01Z,PCA for Enhanced Cross-Dataset Generalizability in Breast Ultrasound   Tumor Segmentation,PCA für verbesserte Cross-Dataset-Verallgemeinerung in der Brust-Ultraschall-Tumor-Segmentierung,"五氯苯甲醚,用于在乳房超声波肿瘤分割中增强交叉数据的通用性",http://arxiv.org/abs/2505.23587v1
69,"Reinforcement learning algorithms are fundamental to align large language models with human preferences and to enhance their reasoning capabilities. However, current reinforcement learning algorithms often suffer from training instability due to loose on-policy constraints and computational inefficiency due to auxiliary models. In this work, we propose On-Policy RL with Optimal reward baseline (OPO), a novel and simplified reinforcement learning algorithm designed to address these challenges. OPO emphasizes the importance of exact on-policy training, which empirically stabilizes the training process and enhances exploration. Moreover, OPO introduces the optimal reward baseline that theoretically minimizes gradient variance. We evaluate OPO on mathematical reasoning benchmarks. The results demonstrate its superior performance and training stability without additional models or regularization terms. Furthermore, OPO achieves lower policy shifts and higher output entropy, encouraging more diverse and less repetitive responses. These results highlight OPO as a promising direction for stable and effective reinforcement learning in large language model alignment and reasoning tasks. The implementation is provided at https://github.com/microsoft/LMOps/tree/main/opo.","Yaru Hao, Li Dong, Xun Wu, Shaohan Huang, Zewen Chi, Furu Wei",2025-05-29T15:58:04Z,On-Policy RL with Optimal Reward Baseline,On-Policy RL mit optimaler Prämienbasis,具有最佳回报基准的 政策性RL,http://arxiv.org/abs/2505.23585v1
70,"Time series forecasting plays a vital role in various real-world applications and has attracted significant attention in recent decades. While recent methods have achieved remarkable accuracy by incorporating advanced inductive biases and training strategies, we observe that instance-level variations remain a significant challenge. These variations--stemming from distribution shifts, missing data, and long-tail patterns--often lead to suboptimal forecasts for specific instances, even when overall performance appears strong. To address this issue, we propose a model-agnostic framework, PIR, designed to enhance forecasting performance through Post-forecasting Identification and Revision. Specifically, PIR first identifies biased forecasting instances by estimating their accuracy. Based on this, the framework revises the forecasts using contextual information, including covariates and historical time series, from both local and global perspectives in a post-processing fashion. Extensive experiments on real-world datasets with mainstream forecasting models demonstrate that PIR effectively mitigates instance-level errors and significantly improves forecasting reliability.","Zhiding Liu, Mingyue Cheng, Guanhao Zhao, Jiqian Yang, Qi Liu, Enhong Chen",2025-05-29T15:56:41Z,Improving Time Series Forecasting via Instance-aware Post-hoc Revision,Verbesserung der Zeitreihenprognose über Instance-aware Post-hoc-Revision,"改进时间序列预测,通过 "" 热后后预测 "" 改进时间序列预测",http://arxiv.org/abs/2505.23583v1
71,"Autonomous Underwater Vehicles (AUVs) encounter significant energy, control and navigation challenges in complex underwater environments, particularly during close-proximity operations, such as launch and recovery (LAR), where fluid interactions and wake effects present additional navigational and energy challenges. Traditional path planning methods fail to incorporate these detailed wake structures, resulting in increased energy consumption, reduced control stability, and heightened safety risks. This paper presents a novel wake-informed, 3D path planning approach that fully integrates localized wake effects and global currents into the planning algorithm. Two variants of the A* algorithm - a current-informed planner and a wake-informed planner - are created to assess its validity and two neural network models are then trained to approximate these planners for real-time applications. Both the A* planners and NN models are evaluated using important metrics such as energy expenditure, path length, and encounters with high-velocity and turbulent regions. The results demonstrate a wake-informed A* planner consistently achieves the lowest energy expenditure and minimizes encounters with high-velocity regions, reducing energy consumption by up to 11.3%. The neural network models are observed to offer computational speedup of 6 orders of magnitude, but exhibit 4.51 - 19.79% higher energy expenditures and 9.81 - 24.38% less optimal paths. These findings underscore the importance of incorporating detailed wake structures into traditional path planning algorithms and the benefits of neural network approximations to enhance energy efficiency and operational safety for AUVs in complex 3D domains.","Zachary Cooper-Baldock, Stephen Turnock, Karl Sammut",2025-05-29T15:53:13Z,Wake-Informed 3D Path Planning for Autonomous Underwater Vehicles Using   A* and Neural Network Approximations,Wake-Informierte 3D-Pfadplanung für autonome Unterwasserfahrzeuge mit A*- und Neuralnetzwerk-Annäherungen,使用A* 和神经网络相近的自动水下车辆的觉醒3D路径规划,http://arxiv.org/abs/2502.01918v2
72,"Unlocking deep, interpretable biological reasoning from complex genomic data is a major AI challenge hindering scientific discovery. Current DNA foundation models, despite strong sequence representation, struggle with multi-step reasoning and lack inherent transparent, biologically intuitive explanations. We introduce BioReason, a pioneering architecture that, for the first time, deeply integrates a DNA foundation model with a Large Language Model (LLM). This novel connection enables the LLM to directly process and reason with genomic information as a fundamental input, fostering a new form of multimodal biological understanding. BioReason's sophisticated multi-step reasoning is developed through supervised fine-tuning and targeted reinforcement learning, guiding the system to generate logical, biologically coherent deductions. On biological reasoning benchmarks including KEGG-based disease pathway prediction - where accuracy improves from 88% to 97% - and variant effect prediction, BioReason demonstrates an average 15% performance gain over strong single-modality baselines. BioReason reasons over unseen biological entities and articulates decision-making through interpretable, step-by-step biological traces, offering a transformative approach for AI in biology that enables deeper mechanistic insights and accelerates testable hypothesis generation from genomic data. Data, code, and checkpoints are publicly available at https://github.com/bowang-lab/BioReason","Adibvafa Fallahpour, Andrew Magnuson, Purav Gupta, Shihao Ma, Jack Naimer, Arnav Shah, Haonan Duan, Omar Ibrahim, Hani Goodarzi, Chris J. Maddison, Bo Wang",2025-05-29T15:49:27Z,BioReason: Incentivizing Multimodal Biological Reasoning within a   DNA-LLM Model,BioReason: Förderung multimodaler biologischer Vernunft innerhalb eines DNA-LLM-Modells,BioReason:在DNA-LLM模型中激励多式生物理由,http://arxiv.org/abs/2505.23579v1
73,"As AI models are deployed with increasing autonomy, it is important to ensure they do not take harmful actions unnoticed. As a potential mitigation, we investigate Chain-of-Thought (CoT) monitoring, wherein a weaker trusted monitor model continuously oversees the intermediate reasoning steps of a more powerful but untrusted model. We compare CoT monitoring to action-only monitoring, where only final outputs are reviewed, in a red-teaming setup where the untrusted model is instructed to pursue harmful side tasks while completing a coding problem. We find that CoT monitoring improves detection by up to 27 percentage points in scenarios where action-only monitoring fails to reliably identify sabotage. However, CoT traces can also contain misleading rationalizations that deceive the monitor, reducing performance in more obvious sabotage cases. To address this, we introduce a hybrid protocol that independently scores both reasoning and final outputs and combines them using a weighted average. This hybrid monitor consistently outperforms both CoT and action-only monitors across all tested models and tasks, with detection rates over four times higher than action-only monitoring for subtle deception scenarios.","Benjamin Arnav, Pablo Bernabeu-Pérez, Nathan Helm-Burger, Tim Kostolansky, Hannes Whittingham, Mary Phuong",2025-05-29T15:47:36Z,CoT Red-Handed: Stress Testing Chain-of-Thought Monitoring,CoT Red-Handed: Stresstesting Chain-of-Thought-Überwachung,COT 红手:压力测试研究链监测,http://arxiv.org/abs/2505.23575v1
74,"We introduce a novel unsupervised learning method for time series data with latent dynamical structure: the recognition-parametrized Gaussian state space model (RP-GSSM). The RP-GSSM is a probabilistic model that learns Markovian Gaussian latents explaining statistical dependence between observations at different time steps, combining the intuition of contrastive methods with the flexible tools of probabilistic generative models. Unlike contrastive approaches, the RP-GSSM is a valid probabilistic model learned via maximum likelihood. Unlike generative approaches, the RP-GSSM has no need for an explicit network mapping from latents to observations, allowing it to focus model capacity on inference of latents. The model is both tractable and expressive: it admits exact inference thanks to its jointly Gaussian latent prior, while maintaining expressivity with an arbitrarily nonlinear neural network link between observations and latents. These qualities allow the RP-GSSM to learn task-relevant latents without ad-hoc regularization, auxiliary losses, or optimizer scheduling. We show how this approach outperforms alternatives on problems that include learning nonlinear stochastic dynamics from video, with or without background distractors. Our results position the RP-GSSM as a useful foundation model for a variety of downstream applications.","Samo Hromadka, Kai Biegun, Lior Fox, James Heald, Maneesh Sahani",2025-05-29T15:44:20Z,Maximum Likelihood Learning of Latent Dynamics Without Reconstruction,Maximale Wahrscheinlichkeit Lernen von latenten Dynamiken ohne Rekonstruktion,学习没有重建的原始动力学,http://arxiv.org/abs/2505.23569v1
75,"We introduce dro, an open-source Python library for distributionally robust optimization (DRO) for regression and classification problems. The library implements 14 DRO formulations and 9 backbone models, enabling 79 distinct DRO methods. Furthermore, dro is compatible with both scikit-learn and PyTorch. Through vectorization and optimization approximation techniques, dro reduces runtime by 10x to over 1000x compared to baseline implementations on large-scale datasets. Comprehensive documentation is available at https://python-dro.org.","Jiashuo Liu, Tianyu Wang, Henry Lam, Hongseok Namkoong, Jose Blanchet",2025-05-29T15:39:12Z,DRO: A Python Library for Distributionally Robust Optimization in   Machine Learning,DRO: Eine Python-Bibliothek für Distributional Robuste Optimierung im maschinellen Lernen,DRO: 一个用于在机器学习中进行分配式强力优化的 Python 图书馆,http://arxiv.org/abs/2505.23565v1
76,"Enhancing the reasoning capabilities of large language models effectively using reinforcement learning (RL) remains a crucial challenge. Existing approaches primarily adopt two contrasting advantage estimation granularities: Token-level methods (e.g., PPO) aim to provide the fine-grained advantage signals but suffer from inaccurate estimation due to difficulties in training an accurate critic model. On the other extreme, trajectory-level methods (e.g., GRPO) solely rely on a coarse-grained advantage signal from the final reward, leading to imprecise credit assignment. To address these limitations, we propose Segment Policy Optimization (SPO), a novel RL framework that leverages segment-level advantage estimation at an intermediate granularity, achieving a better balance by offering more precise credit assignment than trajectory-level methods and requiring fewer estimation points than token-level methods, enabling accurate advantage estimation based on Monte Carlo (MC) without a critic model. SPO features three components with novel strategies: (1) flexible segment partition; (2) accurate segment advantage estimation; and (3) policy optimization using segment advantages, including a novel probability-mask strategy. We further instantiate SPO for two specific scenarios: (1) SPO-chain for short chain-of-thought (CoT), featuring novel cutpoint-based partition and chain-based advantage estimation, achieving $6$-$12$ percentage point improvements in accuracy over PPO and GRPO on GSM8K. (2) SPO-tree for long CoT, featuring novel tree-based advantage estimation, which significantly reduces the cost of MC estimation, achieving $7$-$11$ percentage point improvements over GRPO on MATH500 under 2K and 4K context evaluation. We make our code publicly available at https://github.com/AIFrameResearch/SPO.","Yiran Guo, Lijie Xu, Jie Liu, Dan Ye, Shuang Qiu",2025-05-29T15:38:19Z,Segment Policy Optimization: Effective Segment-Level Credit Assignment   in RL for Large Language Models,Segment Policy Optimization: Effektive Segment-Level-Kreditvergabe in RL für große Sprachmodelle,政策优化优化:大语言模式RL中有效的分部一级信用分配,http://arxiv.org/abs/2505.23564v1
