,abstract,authors,date,title,title-de,title-zh,url
0,"Following Milner's seminal paper, the representation of functions as processes has received considerable attention. For pure $\lambda$-calculus, the process representations yield (at best) non-extensional $\lambda $-theories (i.e., $\beta$ rule holds, whereas $\eta$ does not).   In the paper, we study how to obtain extensional representations, and how to move between extensional and non-extensional representations. Using Internal $\pi$, $\mathrm{I}\pi$ (a subset of the $\pi$-calculus in which all outputs are bound), we develop a refinement of Milner's original encoding of functions as processes that is parametric on certain abstract components called wires. These are, intuitively, processes whose task is to connect two end-point channels. We show that when a few algebraic properties of wires hold, the encoding yields a $\lambda$-theory. Exploiting the symmetries and dualities of $\mathrm{I}\pi$, we isolate three main classes of wires. The first two have a sequential behaviour and are dual of each other; the third has a parallel behaviour and is the dual of itself. We show the adoption of the parallel wires yields an extensional $\lambda$-theory; in fact, it yields an equality that coincides with that of B\""ohm trees with infinite $\eta$. In contrast, the other two classes of wires yield non-extensional $\lambda$-theories whose equalities are those of the L\'evy-Longo and B\""ohm trees.","Ken Sakayori, Davide Sangiorgi",2025-05-29T13:36:48Z,Extensional and Non-extensional Functions as Processes,Erweiterungs- und Nichterweiterungsfunktionen als Prozesse,作为处理过程的扩展和非扩展函数,http://arxiv.org/abs/2405.03536v2
1,"We present a data-driven approach to the quantitative verification of probabilistic programs and stochastic dynamical models. Our approach leverages neural networks to compute tight and sound bounds for the probability that a stochastic process hits a target condition within finite time. This problem subsumes a variety of quantitative verification questions, from the reachability and safety analysis of discrete-time stochastic dynamical models, to the study of assertion-violation and termination analysis of probabilistic programs. We rely on neural networks to represent supermartingale certificates that yield such probability bounds, which we compute using a counterexample-guided inductive synthesis loop: we train the neural certificate while tightening the probability bound over samples of the state space using stochastic optimisation, and then we formally check the certificate's validity over every possible state using satisfiability modulo theories; if we receive a counterexample, we add it to our set of samples and repeat the loop until validity is confirmed. We demonstrate on a diverse set of benchmarks that, thanks to the expressive power of neural networks, our method yields smaller or comparable probability bounds than existing symbolic methods in all cases, and that our approach succeeds on models that are entirely beyond the reach of such alternative techniques.","Alessandro Abate, Alec Edwards, Mirco Giacobbe, Hashan Punchihewa, Diptarko Roy",2025-05-29T10:15:46Z,Quantitative Verification with Neural Networks,Quantitative Überprüfung mit neuralen Netzen,与神经网络进行定量核查,http://arxiv.org/abs/2301.06136v5
2,"Selecting a subset of cells is a common task in data engineering, for example, to remove errors or select only specific parts of a table. Multiple approaches to express this selection exist. One option is numeric indexing, commonly found in general programming languages, where a tuple of numbers identifies the cell. Alternatively, the separate dimensions can be referred to using different enumeration schemes like ""A1"" for the first cell, commonly found in software such as spreadsheet systems.   In a large-scale controlled experiment with student participants as proxy for data practitioners, we compare the two options with respect to speed and correctness of reading and writing code.   The results show that, when reading code, participants make less mistakes using spreadsheet-style syntax. Additionally, when writing code, they make fewer mistakes and are faster when using spreadsheet syntax compared to numeric syntax.   From this, a domain-specific syntax, such as spreadsheet syntax for data engineering, appears to be a promising alternative to explore in future tools to support practitioners without a software engineering background.","Philip Heltweg, Dirk Riehle, Georg-Daniel Schwarz",2025-05-29T09:49:14Z,Is spreadsheet syntax better than numeric indexing for cell selection?,Ist die Tabellensyntax besser als die numerische Indexierung für die Zellenauswahl?,选择单元格的电子表格语法是否比数字索引更好?,http://arxiv.org/abs/2505.23296v1
3,"Large language models (LLMs) are increasingly integrated in software development, but ensuring correctness in LLM-generated code remains challenging and often requires costly manual review. Verifiable code generation -- jointly generating code, specifications, and proofs of code-specification alignment -- offers a promising path to address this limitation and further unleash LLMs' benefits in coding. Yet, there exists a significant gap in evaluation: current benchmarks often lack support for end-to-end verifiable code generation. In this paper, we introduce Verina (Verifiable Code Generation Arena), a high-quality benchmark enabling a comprehensive and modular evaluation of code, specification, and proof generation as well as their compositions. Verina consists of 189 manually curated coding tasks in Lean, with detailed problem descriptions, reference implementations, formal specifications, and extensive test suites. Our extensive evaluation of state-of-the-art LLMs reveals significant challenges in verifiable code generation, especially in proof generation, underscoring the need for improving LLM-based theorem provers in verification domains. The best model, OpenAI o4-mini, generates only 61.4% correct code, 51.0% sound and complete specifications, and 3.6% successful proofs, with one trial per task. We hope Verina will catalyze progress in verifiable code generation by providing a rigorous and comprehensive benchmark. We release our dataset on https://huggingface.co/datasets/sunblaze-ucb/verina and our evaluation code on https://github.com/sunblaze-ucb/verina.","Zhe Ye, Zhengxu Yan, Jingxuan He, Timothe Kasriel, Kaiyu Yang, Dawn Song",2025-05-29T06:12:52Z,VERINA: Benchmarking Verifiable Code Generation,VERINA: Benchmarking der überprüfbaren Code-Generierung,VERINA:可核实代码生成基准,http://arxiv.org/abs/2505.23135v1
4,"Large Language Models (LLMs) are increasingly being used to automate programming tasks. Yet, LLMs' capabilities in reasoning about program semantics are still inadequately studied, leaving significant potential for further exploration. This paper introduces FormalBench, a comprehensive benchmark designed to evaluate LLMs' reasoning abilities on program semantics, particularly via the task of synthesizing formal program specifications to assist verifying program correctness. This task requires both comprehensive reasoning over all possible program executions and the generation of precise, syntactically correct expressions that adhere to formal syntax and semantics. Using this benchmark, we evaluated the ability of LLMs in synthesizing consistent and complete specifications. Our findings show that LLMs perform well with simple control flows but struggle with more complex structures, especially loops, even with advanced prompting. Additionally, LLMs exhibit limited robustness against semantic-preserving transformations. We also highlight common failure patterns and design self-repair prompts, improving success rates by 25%.","Thanh Le-Cong, Bach Le, Toby Murray",2025-05-29T06:07:32Z,Can LLMs Reason About Program Semantics? A Comprehensive Evaluation of   LLMs on Formal Specification Inference,Kann LLMs Grund über Programm Semantik? Eine umfassende Bewertung von LLMs auf formale Spezifikation Inferenz,CLLMs 方案语义学理由:全面评价关于正式具体推断的LLMs,http://arxiv.org/abs/2503.04779v4
5,"We introduce CASS, the first large-scale dataset and model suite for cross-architecture GPU code transpilation, targeting both source-level (CUDA <--> HIP) and assembly-level (Nvidia SASS <--> AMD RDNA3) translation. The dataset comprises 70k verified code pairs across host and device, addressing a critical gap in low-level GPU code portability. Leveraging this resource, we train the CASS family of domain-specific language models, achieving 95% source translation accuracy and 37.5% assembly translation accuracy, substantially outperforming commercial baselines such as GPT-4o, Claude, and Hipify. Our generated code matches native performance in over 85% of test cases, preserving runtime and memory behavior. To support rigorous evaluation, we introduce CASS-Bench, a curated benchmark spanning 16 GPU domains with ground-truth execution. All data, models, and evaluation tools are released as open source to foster progress in GPU compiler tooling, binary compatibility, and LLM-guided hardware translation.","Ahmed Heakl, Sarim Hashmi, Gustavo Bertolo Stahl, Seung Hun Eddie Han, Salman Khan, Abdulrahman Mahmoud",2025-05-29T05:44:32Z,"CASS: Nvidia to AMD Transpilation with Data, Models, and Benchmark","CASS: Nvidia zu AMD Transpilation mit Daten, Modellen und Benchmark",CASS: Nvidia 到AMD 传输数据、模型和基准,http://arxiv.org/abs/2505.16968v3
6,"Diffusion LLMs have emerged as a promising alternative to conventional autoregressive LLMs, offering significant potential for improved runtime efficiency. However, existing diffusion models lack the ability to provably enforce user-specified formal constraints, such as regular expressions, which makes them unreliable for tasks that require structured outputs, such as fixed-schema JSON generation. Unlike autoregressive models that generate tokens sequentially, diffusion LLMs predict a block of tokens in parallel. This parallelism makes traditional constrained decoding algorithms, which are designed for sequential token prediction, ineffective at preserving the true output distribution. To address this limitation, we propose DINGO, a dynamic programming-based constrained decoding strategy that is both efficient and provably distribution-preserving. DINGO enables sampling of output strings with the highest probability under the model's predicted distribution, while strictly satisfying any user-specified regular expression. On standard symbolic math and JSON generation benchmarks, DINGO achieves up to a 68 percentage point improvement over unconstrained inference","Tarun Suresh, Debangshu Banerjee, Shubham Ugare, Sasa Misailovic, Gagandeep Singh",2025-05-29T04:04:54Z,DINGO: Constrained Inference for Diffusion LLMs,DINGO: Beschränkte Schlussfolgerung für Diffusion LLMs,DINGO: 扩散长效LMM的连续推论,http://arxiv.org/abs/2505.23061v1
7,"While AI programming tools hold the promise of increasing programmers' capabilities and productivity to a remarkable degree, they often exclude users from essential decision-making processes, causing many to effectively ""turn off their brains"" and over-rely on solutions provided by these systems. These behaviors can have severe consequences in critical domains, like software security. We propose Human-in-the-loop Decoding, a novel interaction technique that allows users to observe and directly influence LLM decisions during code generation, in order to align the model's output with their personal requirements. We implement this technique in HiLDe, a code completion assistant that highlights critical decisions made by the LLM and provides local alternatives for the user to explore. In a within-subjects study (N=18) on security-related tasks, we found that HiLDe led participants to generate significantly fewer vulnerabilities and better align code generation with their goals compared to a traditional code completion assistant.","Emmanuel Anaya González, Raven Rothkopf, Sorin Lerner, Nadia Polikarpova",2025-05-28T22:11:17Z,HiLDe: Intentional Code Generation via Human-in-the-Loop Decoding,HiLDe: Intentionale Code-Generierung über Human-in-the-Loop-Dekodierung,"HILDe:通过 "" 人类在圈套解码 "" 进行有意代码生成",http://arxiv.org/abs/2505.22906v1
8,"I present a model of universal parallel computation called $\Delta$-Nets, and a method to translate $\lambda$-terms into $\Delta$-nets and back. Together, the model and the method constitute an algorithm for optimal parallel $\lambda$-reduction, solving the longstanding enigma with groundbreaking clarity. I show that the $\lambda$-calculus can be understood as a projection of $\Delta$-Nets -- one that severely restricts the structure of sharing, among other drawbacks. Unhindered by these restrictions, the $\Delta$-Nets model opens the door to new highly parallel programming language implementations and computer architectures that are more efficient and performant than previously possible.",Daniel Augusto Rizzi Salvadori,2025-05-28T18:23:01Z,$Δ$-Nets: Interaction-Based System for Optimal Parallel   $λ$-Reduction,$Δ$-Nets: Interaktionsbasiertes System für eine optimale parallele $λ$-Reduktion,$$-净额:最佳平行互动系统$$$美元-削减,http://arxiv.org/abs/2505.20314v2
9,"Fast machine code generation is especially important for fast start-up just-in-time compilation, where the compilation time is part of the end-to-end latency. However, widely used compiler frameworks like LLVM do not prioritize fast compilation and require an extra IR translation step increasing latency even further; and rolling a custom code generator is a substantial engineering effort, especially when targeting multiple architectures.   Therefore, in this paper, we present TPDE, a compiler back-end framework that adapts to existing code representations in SSA form. Using an IR-specific adapter providing canonical access to IR data structures and a specification of the IR semantics, the framework performs one analysis pass and then performs the compilation in just a single pass, combining instruction selection, register allocation, and instruction encoding. The generated target instructions are primarily derived code written in high-level language through LLVM's Machine IR, easing portability to different architectures while enabling optimizations during code generation.   To show the generality of our framework, we build a new back-end for LLVM from scratch targeting x86-64 and AArch64. Performance results on SPECint 2017 show that we can compile LLVM-IR 8--24x faster than LLVM -O0 while being on-par in terms of run-time performance. We also demonstrate the benefits of adapting to domain-specific IRs in JIT contexts, particularly WebAssembly and database query compilation, where avoiding the extra IR translation further reduces compilation latency.","Tobias Schwarz, Tobias Kamm, Alexis Engelke",2025-05-28T17:25:53Z,TPDE: A Fast Adaptable Compiler Back-End Framework,TPDE: Ein schnell anpassbares Compiler Back-End Framework,TPDE:一个快速可调适的汇编者后端框架,http://arxiv.org/abs/2505.22610v1
10,"Inductive families provide a convenient way of programming with dependent types. Yet, when it comes to compilation, their default linked-tree runtime representations, as well as the need to convert between different indexed views of the same data, can lead to unsatisfactory runtime performance. In this paper, we introduce a language with dependent types, and inductive families with customisable representations. Representations are a version of Wadler's views, refined to inductive families like in Epigram, but with compilation guarantees: a represented inductive family will not leave any runtime traces behind, without relying on heuristics such as deforestation. This way, we can build a library of convenient inductive families based on a minimal set of primitives, whose re-indexing and conversion functions are erased during compilation. We show how we can express optimisation techniques such as representing Nat-like types as GMP-style big integers, without special casing in the compiler. With dependent types, reasoning about data representations is also possible through a provided modality. This yields computationally irrelevant isomorphisms between the original and represented data.","Constantine Theocharis, Edwin Brady",2025-05-28T13:25:26Z,Custom Representations of Inductive Families,Benutzerdefinierte Darstellungen von induktiven Familien,感养家庭习俗代表,http://arxiv.org/abs/2505.21225v2
11,"Constraint Handling Rules (CHR) is a rule-based programming language which is typically embedded into a general-purpose language. There exists a plethora of implementations of CHR for numerous host languages. However, the existing implementations often reinvent the way to embed CHR, which impedes maintenance and weakens assertions of correctness. To formalize and thereby unify the embedding of CHR into arbitrary host languages, we introduced the framework FreeCHR and proved it to be a valid representation of classical CHR. Until now, this framework only includes a translation of the very abstract operational semantics of CHR which, due to its abstract nature, introduces several practical issues. In this paper, we introduce an execution algorithm for FreeCHR. We derive it from the refined operational semantics of CHR, which resolve the issues introduced by the very abstract semantics. We also prove soundness of the algorithm with respect to the very abstract semantics of FreeCHR. Hereby we provide a unified and an easy to implement guideline for new CHR implementations, as well as an algorithmic definition of the refined operational semantics.","Sascha Rechenberger, Thom Frühwirth",2025-05-28T09:19:33Z,An instance of FreeCHR with refined operational semantics,Eine Instanz von FreeCHR mit raffinierter operativer Semantik,""" 自由人权中心 "" 的例子,其中精炼了操作语义",http://arxiv.org/abs/2505.22155v1
12,"In this work, we propose KPerfIR, a novel multilevel compiler-centric infrastructure to enable the development of customizable, extendable, and portable profiling tools tailored for modern artificial intelligence (AI) workloads on modern GPUs. Our approach integrates profiling capabilities directly into the compiler workflow, allowing profiling functionalities to be implemented as compiler passes, offering a programmable and reusable framework for performance analysis. This design bridges the gap between compilers and profilers, enabling fine-grained insights into complex optimization challenges such as overlapping the execution of fine-grained function units on GPUs. KPerfIR is integrated into the Triton infrastructure to highlight the power of a compiler-centric approach to advance performance analysis and optimization in the ever-evolving landscape of AI compilers. Our evaluation shows that our tool incurs low overhead (8.2%), provides accurate measurements (2% relative error), and delivers actionable insights into complicated GPU intra-kernel optimizations.","Yue Guan, Yuanwei Fang, Keren Zhou, Corbin Robeck, Manman Ren, Zhongkai Yu, Yufei Ding, Adnan Aziz",2025-05-27T18:38:15Z,KPerfIR: Towards an Open and Compiler-centric Ecosystem for GPU Kernel   Performance Tooling on Modern AI Workloads,KPerfIR: Auf dem Weg zu einem offenen und kompilerzentrierten Ökosystem für GPU-Kernel Performance Tooling auf modernen KI-Workloads,"KPerfIR:努力建立一个开放的、以编纂者为中心的生态系统,用于在现代AI 工作负荷上使用 GPU 内核性能工具",http://arxiv.org/abs/2505.21661v1
13,"Recently, interest has increased in applying reactive synthesis to richer-than-Boolean domains. A major (undecidable) challenge in this area is to establish when certain repeating behaviour terminates in a desired state when the number of steps is unbounded. Existing approaches struggle with this problem, or can handle at most deterministic games with B\""uchi goals. This work goes beyond by contributing the first effectual approach to synthesis with full LTL objectives, based on Boolean abstractions that encode both safety and liveness properties of the underlying infinite arena. We take a CEGAR approach: attempting synthesis on the Boolean abstraction, checking spuriousness of abstract counterstrategies through invariant checking, and refining the abstraction based on counterexamples. We reduce the complexity, when restricted to predicates, of abstracting and synthesising by an exponential through an efficient binary encoding. This also allows us to eagerly identify useful fairness properties. Our discrete synthesis tool outperforms the state-of-the-art on linear integer arithmetic (LIA) benchmarks from literature, solving almost double as many syntesis problems as the current state-of-the-art. It also solves slightly more problems than the second-best realisability checker, in one-third of the time. We also introduce benchmarks with richer objectives that other approaches cannot handle, and evaluate our tool on them.","Shaun Azzopardi, Luca Di Stefano, Nir Piterman, Gerardo Schneider",2025-05-27T10:28:56Z,Full LTL Synthesis over Infinite-state Arenas,Vollständige LTL-Synthese über Infinite-State-Arenen,无限状态阿雷纳斯地区全面LTL综合综合,http://arxiv.org/abs/2307.09776v3
14,"We address the problem of local type inference for a language based on System F with context-free session types. We present an algorithm that leverages the bidirectional type checking approach to propagate type information, enabling first class polymorphism while addressing the intricacies brought about by the sequential composition operator and type equivalence. The algorithm improves the language's usability by eliminating the need for type annotations at type application sites.","Bernardo Almeida, Andreia Mordido, Vasco T. Vasconcelos",2025-05-27T08:05:23Z,Local Type Inference for Context-Free Session Types,Lokale Typ-Schlussfolgerung für kontextfreie Sitzungstypen,无背景会话类型本地类型推推推,http://arxiv.org/abs/2505.20855v1
15,"In the shared variable model of concurrency, guarded atomic actions restrict the possible interference between processes by regions of atomic execution. The guard specifies the condition for entering an atomic region. That is a convenient model for the specification and verification of concurrent programs, but has eschewed efficient execution so far. This article shows how guarded atomic actions, when attached to objects, can be implemented highly efficiently using a combination of coroutines, operating-system worker threads, and dedicated management of object queues and stacks. The efficiency of an experimental language, Lime, is shown to compare favourably with that of C/Pthreads, Go, Erlang, Java, and Haskell on synthetic benchmarks.","Shucai Yao, Emil Sekerinski",2025-05-27T08:02:25Z,An Efficient Implementation of Guard-Based Synchronization for an   Object-Oriented Programming Language,Effiziente Implementierung von Guard-Based Synchronization für eine objektorientierte Programmiersprache,"高效率地实施以警卫为基础的同步,以用于以目标为导向的方案编制语言",http://arxiv.org/abs/2505.20850v1
16,"CLASS is a proof-of-concept general purpose linear programming language, flexibly supporting realistic concurrent programming idioms, and featuring an expressive linear type system ensuring that programs (1) never misuse or leak stateful resources or memory, (2) never deadlock, and (3) always terminate. The design of CLASS and the strong static guarantees of its type system originates in its Linear Logic and proposition-as-types foundations. However, instead of focusing on its theoretical foundations, this paper briefly illustrates, in a tutorial form, an identifiable CLASS session-based programming style where strong correctness properties are automatically ensured by type-checking. Our more challenging examples include concurrent thread and memory-safe mutable ADTs, lazy stream programming, and manipulation of linear digital assets as used in smart contracts.",Luís Caires,2025-05-27T08:02:01Z,Thread and Memory-Safe Programming with CLASS,Thread- und Memory-sichere Programmierung mit CLASS,使用 CLASS 的线索和内存安全编程,http://arxiv.org/abs/2505.20848v1
17,"Concurrent programming often entails meticulous pairing of sends and receives between participants to avoid deadlock. Choreographic programming alleviates this burden by specifying the system as a single program. However, there are more applications than implementations of choreographies, and developing new implementations takes a lot of time and effort. Our work uses Racket to expedite building a new choreographic language called Choret. Racket has a powerful macro system which allows Choret to reuse much of its infrastructure for greater functionality and correctness.","Alexander Bohosian, Andrew K. Hirsch",2025-05-27T08:01:26Z,Choreographies as Macros,Choreographien als Makros,作为宏的舞蹈,http://arxiv.org/abs/2505.20845v1
