,abstract,authors,date,title,title-de,title-zh,url
18,"This paper presents a novel symbolic algorithm for the Maximal End Component (MEC) decomposition of a Markov Decision Process (MDP). The key idea behind our algorithm INTERLEAVE is to interleave the computation of Strongly Connected Components (SCCs) with eager elimination of redundant state-action pairs, rather than performing these computations sequentially as done by existing state-of-the-art algorithms. Even though our approach has the same complexity as prior works, an empirical evaluation of INTERLEAVE on the standardized Quantitative Verification Benchmark Set demonstrates that it solves 19 more benchmarks (out of 379) than the closest previous algorithm. On the 149 benchmarks that prior approaches can solve, we demonstrate a 3.81x average speedup in runtime.","Suguman Bansal, Ramneet Singh",2025-05-27T05:43:55Z,INTERLEAVE: A Faster Symbolic Algorithm for Maximal End Component   Decomposition,INTERLEAVE: Ein schnellerer symbolischer Algorithmus für maximale Endkomponentenzersetzung,最大末端组件分解的更快的符号性算法,http://arxiv.org/abs/2505.20748v1
19,"GPU computing is embracing weak memory concurrency for performance improvement. However, compared to CPUs, modern GPUs provide more fine-grained concurrency features such as scopes, have additional properties like divergence, and thereby follow different weak memory consistency models. These features and properties make concurrent programming on GPUs more complex and error-prone. To this end, we present GPUMC, a stateless model checker to check the correctness of GPU shared-memory concurrent programs under scoped-RC11 weak memory concurrency model. GPUMC explores all possible executions in GPU programs to reveal various errors - races, barrier divergence, and assertion violations. In addition, GPUMC also automatically repairs these errors in the appropriate cases.   We evaluate GPUMC with benchmarks and real-life GPU programs. GPUMC is efficient both in time and memory in verifying large GPU programs where state-of-the-art tools are timed out. In addition, GPUMC identifies all known errors in these benchmarks compared to the state-of-the-art tools.","Soham Chakraborty, S. Krishna, Andreas Pavlogiannis, Omkar Tuppe",2025-05-26T16:47:44Z,GPUMC: A Stateless Model Checker for GPU Weak Memory Concurrency,GPUMC: Ein staatenloser Modellprüfer für GPU-Schwachspeicherkonkurrenz,GPUMC: GPU 弱内存调制货币的无国籍模式检查器,http://arxiv.org/abs/2505.20207v1
20,"Binary decompilation plays a vital role in various cybersecurity and software engineering tasks. Recently, end-to-end decompilation methods powered by large language models (LLMs) have garnered significant attention due to their ability to generate highly readable source code with minimal human intervention. However, existing LLM-based approaches face several critical challenges, including limited capability in reconstructing code structure and logic, low accuracy in data recovery, concerns over data security and privacy, and high computational resource requirements. To address these issues, we develop the CodeInverter Suite, making three contributions: (1) the CodeInverter Workflow (CIW) is a novel prompt engineering workflow that incorporates control flow graphs (CFG) and explicit data mappings to improve LLM-based decompilation. (2) Using CIW on well-known source code datasets, we curate the CodeInverter Dataset (CID), a domain-specific dataset containing 8.69 million samples that contains CFGs and data mapping tables. (3) We train the CoderInverter Models (CIMs) on CID, generating two lightweight LLMs (with 1.3B and 6.7B parameters) intended for efficient inference in privacy-sensitive or resource-constrained environments. Extensive experiments on two benchmarks demonstrate that the CIW substantially enhances the performance of various LLMs across multiple metrics. Our CIM-6.7B can achieve state-of-the-art decompilation performance, outperforming existing LLMs even with over 100x more parameters in decompilation tasks, an average improvement of 11.03% in re-executability, 6.27% in edit similarity.","Peipei Liu, Jian Sun, Rongkang Sun, Li Chen, Zhaoteng Yan, Peizheng Zhang, Dapeng Sun, Dawei Wang, Xiaoling Zhang, Dan Li",2025-05-26T15:58:11Z,The CodeInverter Suite: Control-Flow and Data-Mapping Augmented Binary   Decompilation with LLMs,Die CodeInverter Suite: Control-Flow und Data-Mapping Augmented Binary Decompilation mit LLMs,代码输入器套件:控制-光和数据-制表增强的二进制解析与LLMS,http://arxiv.org/abs/2503.07215v2
21,"Large language models (LLMs) have achieved impressive proficiency on logic and programming tasks, often rivaling expert-level performance. However, generating functionally correct hardware description language (HDL) code from natural language specifications remains challenging, primarily in data-scarce domains.   Therefore, we present Abstractions-of-Thought (AoT) - a training-free, inference-only prompting framework to mitigate misinterpretations and reasoning pitfalls of LLMs through a series of task-based abstractions within the prompting procedure, assisting in the transition from high-level to low-level representations of hardware. Furthermore, AoT consists of the following stages: (1) an LLM-based classification of hardware design patterns, (2) a structured intermediate representation (IR) to separate functional decomposition from code syntax, and (3) a line-by-line pseudocode solution enabling a more direct mapping to the final Verilog implementation. Experimental results on the VerilogEval benchmark depict that AoT demonstrates improvements in functionality when applied to large non-reasoning models (such as GPT-4o, outperforming all baseline techniques (including 1-shot, Chain-of-Thought, and Tree-of-Thought) while significantly reducing the generated tokens by 1.8-5.2x compared to popular Tree-of-Thought prompting.","Matthew DeLorenzo, Kevin Tieu, Prithwish Jana, Piyush Jha, Dileep Kalathil, Vijay Ganesh, Jeyavijayan Rajendran",2025-05-26T15:41:42Z,Abstractions-of-Thought: Intermediate Representations for LLM Reasoning   in Hardware Design,Abstractions-of-Thought: Mittlere Darstellungen für LLM-Reasoning im Hardware-Design,设计硬件设计方面LLM理由的中间代表,http://arxiv.org/abs/2505.15873v2
22,"Large language models (LLMs) have the potential to revolutionize how we design and implement compilers and code translation tools. However, existing LLMs struggle to handle long and complex programs. We introduce LEGO-Compiler, a novel neural compilation system that leverages LLMs to translate high-level languages into assembly code. Our approach centers on three key innovations: LEGO translation, which decomposes the input program into manageable blocks; breaking down the complex compilation process into smaller, simpler verifiable steps by organizing it as a verifiable LLM workflow by external tests; and a feedback mechanism for self-correction. Supported by formal proofs of translation composability, LEGO-Compiler demonstrates high accuracy on multiple datasets, including over 99% on ExeBench and 97.9% on industrial-grade AnsiBench. Additionally, LEGO-Compiler has also acheived near one order-of-magnitude improvement on compilable code size scalability. This work opens new avenues for applying LLMs to system-level tasks, complementing traditional compiler technologies.","Shuoming Zhang, Jiacheng Zhao, Chunwei Xia, Zheng Wang, Yunji Chen, Xiaobing Feng, Huimin Cui",2025-05-26T07:07:54Z,LEGO-Compiler: Enhancing Neural Compilation Through Translation   Composability,LEGO-Compiler: Neurale Kompilierung durch Übersetzungskompatibilität verbessern,LEGO-Compuper:通过翻译集成加强神经汇编,http://arxiv.org/abs/2505.20356v1
23,"Memory errors continue to be a critical concern for programs written in low-level programming languages such as C and C++. Many different memory error defenses have been proposed, each with varying trade-offs in terms of overhead, compatibility, and attack resistance. Some defenses are highly compatible but only provide minimal protection, and can be easily bypassed by knowledgeable attackers. On the other end of the spectrum, capability systems offer very strong (unforgeable) protection, but require novel software and hardware implementations that are incompatible by definition. The challenge is to achieve both very strong protection and high compatibility.   In this paper, we propose {\em Fully Randomized Pointers} FRP as a strong memory error defense that also maintains compatibility with existing binary software. The key idea behind FRP is to design a new pointer encoding scheme that allows for the full randomization of most pointer bits, rendering even brute force attacks impractical. We design a FRP encoding that is: (1) compatible with existing binary code (recompilation not needed); and (2) decoupled from the underlying object layout. FRP is prototyped as: (i) a software implementation (BlueFat) to test security and compatibility; and (ii) a proof-of-concept hardware implementation (GreenFat) to evaluate performance. We show FRP is secure, practical, and compatible at the binary level, while our hardware implementation achieves low performance overheads (< 4%).","Sai Dhawal Phaye, Gregory J. Duck, Roland H. C. Yap, Trevor E. Carlson",2025-05-26T03:01:16Z,Fully Randomized Pointers,Vollkommen Randomisierte Zeiger,完全随机化指针,http://arxiv.org/abs/2405.12513v2
24,"We introduce ${\rm C{\small LEVER}}$, a high-quality, curated benchmark of 161 problems for end-to-end verified code generation in Lean. Each problem consists of (1) the task of generating a specification that matches a held-out ground-truth specification, and (2) the task of generating a Lean implementation that provably satisfies this specification. Unlike prior benchmarks, ${\rm C{\small LEVER}}$ avoids test-case supervision, LLM-generated annotations, and specifications that leak implementation logic or allow vacuous solutions. All outputs are verified post-hoc using Lean's type checker to ensure machine-checkable correctness. We use ${\rm C{\small LEVER}}$ to evaluate several few-shot and agentic approaches based on state-of-the-art language models. These methods all struggle to achieve full verification, establishing it as a challenging frontier benchmark for program synthesis and formal reasoning. Our benchmark can be found on GitHub(https://github.com/trishullab/clever) as well as HuggingFace(https://huggingface.co/datasets/amitayusht/clever). All our evaluation code is also available online(https://github.com/trishullab/clever-prover).","Amitayush Thakur, Jasper Lee, George Tsoukalas, Meghana Sistla, Matthew Zhao, Stefan Zetzsche, Greg Durrett, Yisong Yue, Swarat Chaudhuri",2025-05-25T16:54:01Z,CLEVER: A Curated Benchmark for Formally Verified Code Generation,CLEVER: Ein kuratierter Benchmark für die formal verifizierte Codegenerierung,正式核实的代码生成基准,http://arxiv.org/abs/2505.13938v3
25,"This volume contains the proceedings of PLACES 2025, the 16th edition of the Workshop on Programming Language Approaches to Concurrency and Communication-cEntric Software. The workshop is scheduled to take place in Hamilton, Canada, on May 4, 2025, as a satellite event of ETAPS, the European Joint Conferences on Theory and Practice of Software. PLACES offers a forum for exchanging new ideas on how to address the challenges of concurrent and distributed programming and how to improve the foundations of modern and future computer applications. PLACES welcomes researchers from various fields, and its topics include the design of new programming languages, models for concurrent and distributed systems, type systems, program verification, and applications in various areas (e.g., microservices, sensor networks, blockchains, event processing, business process management).","Farzaneh Derakhshan, Jan Hoffmann",2025-05-25T10:23:50Z,Proceedings 16th International Workshop on Programming Language   Approaches to Concurrency and Communication-cEntric Software,16. Internationaler Workshop zur Programmierung von Sprachkonzepten für Concurrency und Communication-cEntric Software,第16次关于以方案语言处理货币和通信软件的国际讲习班,http://arxiv.org/abs/2505.19078v1
26,"Important tasks such as reasoning and planning are fundamentally algorithmic, meaning that solving them robustly requires acquiring true reasoning or planning algorithms, rather than shortcuts. Large Language Models lack true algorithmic ability primarily because of the limitations of neural network optimization algorithms, their optimization data and optimization objective, but also due to architectural inexpressivity. To solve this, our paper proposes augmenting LLMs with a library of fundamental operations and sophisticated differentiable programs, so that common algorithms do not need to be learned from scratch. We add memory, registers, basic operations, and adaptive recurrence to a transformer architecture built on LLaMA3. Then, we define a method for directly compiling algorithms into a differentiable starting library, which is used natively and propagates gradients for optimization. In this preliminary study, we explore the feasability of augmenting LLaMA3 with a differentiable computer, for instance by fine-tuning small transformers on simple algorithmic tasks with variable computational depth.","Lucas Saldyt, Subbarao Kambhampati",2025-05-24T23:33:15Z,Algorithmic Language Models with Neurally Compiled Libraries,Algorithmische Sprachmodelle mit neurally compiled Bibliotheken,具有神经编译图书馆的算法语言模型,http://arxiv.org/abs/2407.04899v2
27,"Bespoke data structure operations are common in real-world C code. We identify one common subclass, monotonic data structure traversals (MDSTs), that iterate monotonically through the structure. For example, strlen iterates from start to end of a character array until a null byte is found, and a binary search tree insert iterates from the tree root towards a leaf. We describe a new automated verification tool, Shrinker, to verify MDSTs written in C. Shrinker uses a new program analysis strategy called scapegoating size descent, which is designed to take advantage of the fact that many MDSTs produce very similar traces when executed on an input (e.g., some large list) as when executed on a 'shrunk' version of the input (e.g., the same list but with its first element deleted). We introduce a new benchmark set containing over one hundred instances proving correctness, equivalence, and memory safety properties of dozens of MDSTs found in major C codebases including Linux, NetBSD, OpenBSD, QEMU, Git, and Musl. Shrinker significantly increases the number of monotonic string and list traversals that can be verified vs. a portfolio of state-of-the-art tools.",Matthew Sotoudeh,2025-05-24T18:25:22Z,Automated Verification of Monotonic Data Structure Traversals in C,Automatisierte Überprüfung der monotonen Datenstruktur Traversals in C,自动核查C的单声量数据结构轨迹,http://arxiv.org/abs/2505.18818v1
28,"Hardware accelerators, especially those designed for tensor processing, have become ubiquitous in today's computing landscape. However, even with significant efforts in building compilers, programming these tensor accelerators remains challenging, leaving much of their potential underutilized. Recently, large language models (LLMs), trained on large amounts of code, have shown significant promise in code generation and optimization tasks, but generating low-resource languages like specialized tensor accelerator code still poses a significant challenge. We tackle this challenge with Autocomp, an approach that empowers accelerator programmers to leverage domain knowledge and hardware feedback to optimize code via an automated LLM-driven search. We accomplish this by: 1) formulating each optimization pass as a structured two-phase prompt, divided into planning and code generation phases, 2) inserting domain knowledge during planning via a concise and adaptable optimization menu, and 3) integrating correctness and performance metrics from hardware as feedback at each search iteration. Across three categories of representative workloads and two different accelerators, we demonstrate that Autocomp-optimized code runs 5.6x (GEMM) and 2.7x (convolution) faster than the vendor-provided library, and outperforms expert-level hand-tuned code by 1.4x (GEMM), 1.1x (convolution), and 1.3x (fine-grained linear algebra). Additionally, we demonstrate that optimization schedules generated from Autocomp can be reused across similar tensor operations, improving speedups by up to 24% under a fixed sample budget.","Charles Hong, Sahil Bhatia, Alvin Cheung, Yakun Sophia Shao",2025-05-24T07:35:34Z,Autocomp: LLM-Driven Code Optimization for Tensor Accelerators,Autocomp: LLM-gesteuerte Code-Optimierung für Tensor-Beschleuniger,自动comp: LLM- Driven 代码对 Tensor 加速器的优化,http://arxiv.org/abs/2505.18574v1
