,abstract,abstract-zh,authors,date,title,title-de,title-zh,url
35,"The terms Agentic AI and Multiagentic AI have recently gained popularity in discussions on generative artificial intelligence, often used to describe autonomous software agents and systems composed of such agents. However, the use of these terms confuses these buzzwords with well-established concepts in AI literature: intelligent agents and multi-agent systems. This article offers a critical analysis of this conceptual misuse. We review the theoretical origins of ""agentic"" in the social sciences (Bandura, 1986) and philosophical notions of intentionality (Dennett, 1971), and then summarise foundational works on intelligent agents and multi-agent systems by Wooldridge, Jennings and others. We examine classic agent architectures, from simple reactive agents to Belief-Desire-Intention (BDI) models, and highlight key properties (autonomy, reactivity, proactivity, social capability) that define agency in AI. We then discuss recent developments in large language models (LLMs) and agent platforms based on LLMs, including the emergence of LLM-powered AI agents and open-source multi-agent orchestration frameworks. We argue that the term AI Agentic is often used as a buzzword for what are essentially AI agents, and AI Multiagentic for what are multi-agent systems. This confusion overlooks decades of research in the field of autonomous agents and multi-agent systems. The article advocates for scientific and technological rigour and the use of established terminology from the state of the art in AI, incorporating the wealth of existing knowledge, including standards for multi-agent system platforms, communication languages and coordination and cooperation algorithms, agreement technologies (automated negotiation, argumentation, virtual organisations, trust, reputation, etc.), into the new and promising wave of LLM-based AI agents, so as not to end up reinventing the wheel.","人工智能和多试剂AI这两个术语最近在关于人工智能基因学的讨论中越来越受欢迎,这些术语常常用来描述自主软件代理商和由这些代理商组成的系统。然而,这些术语的用法混淆了AI文献中这些古老的概念:智能代理商和多试剂系统。本文章对这种概念滥用进行了批判性分析。我们审视了社会科学(班杜拉,1986年)中的“试剂”的理论起源和基于LLMS的理论概念(Dennet,1971年),然后由Wooldridge、Jenning等人对智能代理商和多试剂系统的基础工作进行总结。我们论证了典型的代理商结构,从简单的被动反应剂到信仰-死亡(BDI)(BDI)模型和多试剂(I)模型的理论基础。我们接着讨论了大型语言模型(LEM)和基于LMMM的理论平台的最新发展,包括LLMUDER的出现和开放源多源协议的多试剂组织。我们指出,AI的术语术语常常被用来将多层次的理论和多层次的理论化的理论的理论用于AI 。",V. Botti,2025-06-02T09:19:11Z,Agentic AI and Multiagentic: Are We Reinventing the Wheel?,Agentische KI und Multiagentik: Erfinden wir das Rad neu?,A.A.A.和多剂:我们是否在重新发明轮子?,http://arxiv.org/abs/2506.01463v1
36,"This paper introduces an innovative error feedback framework designed to mitigate quantization noise in distributed graph filtering, where communications are constrained to quantized messages. It comes from error spectrum shaping techniques from state-space digital filters, and therefore establishes connections between quantized filtering processes over different domains. In contrast to existing error compensation methods, our framework quantitatively feeds back the quantization noise for exact compensation. We examine the framework under three key scenarios: (i) deterministic graph filtering, (ii) graph filtering over random graphs, and (iii) graph filtering with random node-asynchronous updates. Rigorous theoretical analysis demonstrates that the proposed framework significantly reduces the effect of quantization noise, and we provide closed-form solutions for the optimal error feedback coefficients. Moreover, this quantitative error feedback mechanism can be seamlessly integrated into communication-efficient decentralized optimization frameworks, enabling lower error floors. Numerical experiments validate the theoretical results, consistently showing that our method outperforms conventional quantization strategies in terms of both accuracy and robustness.","本文介绍了一个创新的错误反馈框架,旨在减少分布式图过滤中的量化噪声,因为通信受量化信息的限制。它来自来自来自州-空间数字过滤器的错误频谱塑造技术,从而建立了不同领域量化过滤过程之间的联系。与现有的错误补偿方法不同,我们的框架在数量上反馈量化噪声以获得准确补偿。我们在三个关键情景下审查了框架:(一) 确定式图形过滤,(二) 随机图形过滤,以及(三) 以随机节点不同步更新方式过滤图形过滤。严格的理论分析表明,拟议框架大大降低了量化噪声的效果,我们为最佳错误反馈系数提供了封闭式解决方案。此外,这种定量错误反馈机制可以无缝地纳入通信高效的分散优化框架,从而降低错误层。数字实验验证了理论结果,不断显示我们的方法在准确性和稳健度方面都超过了常规的量化策略。","Xue Xian Zheng, Weihang Liu, Xin Lou, Stefan Vlaski, Tareq Al-Naffouri",2025-06-02T07:57:04Z,Quantitative Error Feedback for Quantization Noise Reduction of   Filtering over Graphs,Quantitatives Fehler-Feedback für Quantisierungsgeräusche Reduzierung der Filterung über Graphen,"数量错误反馈,用于减少图表过滤的量化噪声",http://arxiv.org/abs/2506.01404v1
37,"This article introduces a modeling framework to characterize evacuee response to environmental stimuli during emergency egress. The model is developed in consistency with stress theory, which explains how an organism reacts to environmental stressors. We integrate the theory into the well-known social-force model, and develop a framework to simulate crowd evacuation behavior in multi-compartment buildings. Our method serves as a theoretical basis to study crowd movement at bottlenecks, and simulate their herding and way-finding behavior in normal and hazardous conditions. The pre-movement behavior is also briefly investigated by using opinion dynamics with social group model. The algorithms have been partly tested in FDS+EVAC as well as our simulation platform crowdEgress.","本文介绍了一个模型框架,用以描述疏散人员在紧急情况下对环境刺激的反应特征。该模型是与压力理论相一致的,该模型解释了生物体对环境压力的反应方式。我们将该理论纳入著名的社会力量模型,并开发一个框架,以模拟多区建筑中的人群疏散行为。我们的方法作为理论基础,用于研究人群在瓶颈中的移动,并模拟其在正常和危险条件下的放牧和方式探索行为。运动前的行为也通过使用社会团体模型的见解动态进行简要调查。算法已经在FDS+EVAC以及模拟平台人群中进行了部分测试。","Peng Wang, Xiaoda Wang, Peter Luh, Christian Wilkie, Timo Korhonen, Neal Olderman",2025-06-02T07:53:08Z,Simulation of Crowd Egress with Environmental Stressors,Simulation von Crowd Egress mit Umweltstressoren,以环境压力因素模拟人群反弹,http://arxiv.org/abs/2206.01393v8
38,"Recent advances in Large Language Models (LLMs) have enabled multi-agent systems that simulate real-world interactions with near-human reasoning. While previous studies have extensively examined biases related to protected attributes such as race, the emergence and propagation of biases on socially contentious issues in multi-agent LLM interactions remain underexplored. This study explores how LLM agents shape public opinion through debates on five contentious topics. By simulating over 2,500 debates, we analyze how initially neutral agents, assigned a centrist disposition, adopt specific stances over time. Statistical analyses reveal significant group conformity mirroring human behavior; LLM agents tend to align with numerically dominant groups or more intelligent agents, exerting a greater influence. These findings underscore the crucial role of agent intelligence in shaping discourse and highlight the risks of bias amplification in online interactions. Our results emphasize the need for policy measures that promote diversity and transparency in LLM-generated discussions to mitigate the risks of bias propagation within anonymous online environments.","大语言模型(LLMs)的最近进展使模拟现实世界互动与近乎人性的推理的多试剂系统得以建立。虽然以前的研究广泛审查了种族等受保护属性的偏见,但在多试剂LLM相互作用中,对社会争议问题的偏见的出现和传播仍然未得到充分探讨。本研究探讨了LLM代理人如何通过对五个有争议的议题的辩论影响舆论。我们模拟了2 500多场辩论,分析了最初中立的代理人、指派了中分者、采取特定立场的方式。统计分析显示,在群体上明显符合反映人类行为;LLM代理人往往与数字上占支配地位的群体或更聪明的代理人相配合,施加更大的影响。这些研究结果强调了代理人情报在塑造言论方面的关键作用,并强调了网上互动中扩大偏见的风险。我们的结果强调,在LMM产生的讨论中需要采取政策措施,促进多样性和透明度,以减少匿名在线环境中的偏见传播风险。","Min Choi, Keonwoo Kim, Sungwon Chae, Sangyeob Baek",2025-06-02T05:22:29Z,An Empirical Study of Group Conformity in Multi-Agent Systems,Eine empirische Studie der Gruppenkonformität in Multi-Agent-Systemen,关于多机构机构系统小组合规性的经验研究,http://arxiv.org/abs/2506.01332v1
39,"Failure attribution in LLM multi-agent systems-identifying the agent and step responsible for task failures-provides crucial clues for systems debugging but remains underexplored and labor-intensive. In this paper, we propose and formulate a new research area: automated failure attribution for LLM multi-agent systems. To support this initiative, we introduce the Who&When dataset, comprising extensive failure logs from 127 LLM multi-agent systems with fine-grained annotations linking failures to specific agents and decisive error steps. Using the Who&When, we develop and evaluate three automated failure attribution methods, summarizing their corresponding pros and cons. The best method achieves 53.5% accuracy in identifying failure-responsible agents but only 14.2% in pinpointing failure steps, with some methods performing below random. Even SOTA reasoning models, such as OpenAI o1 and DeepSeek R1, fail to achieve practical usability. These results highlight the task's complexity and the need for further research in this area. Code and dataset are available at https://github.com/mingyin1/Agents_Failure_Attribution","在LLM多试剂系统中,LLM多试剂的失败归属由127个LLM多试剂系统的大量失败日志组成,附有细微的标记,将失败与具体代理人和决定性的错误步骤联系起来。我们利用“谁和何时”来开发和评价三种自动失败归属方法,总结相应的利弊。最佳方法在确定失败责任性剂方面达到53.5%的准确度,但在确定失败步骤方面只有14.2%的准确度,有些方法在随机操作下进行。即使SOTA推理模型,如OpenAI o1和DeepSeek R1, 也未能实现实用的可用性。这些结果突出了任务的复杂性和在这一领域进行进一步研究的必要性。代码和数据集可在https://github.com/mingy1/Agents_Faillure_Atarition上查阅。","Shaokun Zhang, Ming Yin, Jieyu Zhang, Jiale Liu, Zhiguang Han, Jingyang Zhang, Beibin Li, Chi Wang, Huazheng Wang, Yiran Chen, Qingyun Wu",2025-06-02T03:25:55Z,Which Agent Causes Task Failures and When? On Automated Failure   Attribution of LLM Multi-Agent Systems,Welcher Agent verursacht Aufgabenausfälle und wann? Über automatisierte Fehlerzuweisung von LLM-Multiagentensystemen,哪些代理原因任务失败和何时发生?关于LLM多机构系统自动失败归属,http://arxiv.org/abs/2505.00212v3
40,"State-of-the-art methods for Human-AI Teaming and Zero-shot Cooperation focus on task completion, i.e., task rewards, as the sole evaluation metric while being agnostic to how the two agents work with each other. Furthermore, subjective user studies only offer limited insight into the quality of cooperation existing within the team. Specifically, we are interested in understanding the cooperative behaviors arising within the team when trained agents are paired with humans -- a problem that has been overlooked by the existing literature. To formally address this problem, we propose the concept of constructive interdependence -- measuring how much agents rely on each other's actions to achieve the shared goal -- as a key metric for evaluating cooperation in human-agent teams. We interpret interdependence in terms of action interactions in a STRIPS formalism, and define metrics that allow us to assess the degree of reliance between the agents' actions. We pair state-of-the-art agents HAT with learned human models as well as human participants in a user study for the popular Overcooked domain, and evaluate the task reward and teaming performance for these human-agent teams. Our results demonstrate that although trained agents attain high task rewards, they fail to induce cooperative behavior, showing very low levels of interdependence across teams. Furthermore, our analysis reveals that teaming performance is not necessarily correlated with task reward, highlighting that task reward alone cannot reliably measure cooperation arising in a team.","人类-AI团队和零点合作的最先进方法注重任务的完成,即任务奖励,以此作为唯一的评价标准,同时对两个代理人之间如何合作持不可知的态度。此外,主观用户研究只能对团队内部现有合作的质量提供有限的洞察力。具体地说,当训练有素的代理人与人对齐时,我们有兴趣了解团队内部的合作行为 -- -- 这个问题已被现有文献所忽视。为了正式解决这一问题,我们提出建设性相互依存的概念 -- -- 衡量代理人对彼此行动的依赖程度,以实现共同目标 -- -- 作为评价两个代理人之间合作情况的关键衡量标准。我们解释的是,从行动互动角度对团队内部现有的合作质量的认识有限。具体地说,当训练有素的代理人与人打交道时,我们有兴趣了解团队内部的合作行为 -- -- 在现有文献忽视了这一问题。为了正式解决这一问题,我们提出了建设性相互依存的概念 -- -- 衡量代理人之间如何依靠彼此的行动来达到共同目标 -- -- 以衡量这些代理人之间如何实现共同目标 -- -- 作为评价人员代理人团队之间合作的关键衡量标准。我们把行动互动的相互依存性解释为我们评估代理人之间依赖行为的程度。我们的工作表现得分不甚甚深。","Upasana Biswas, Vardhan Palod, Siddhant Bhambri, Subbarao Kambhampati",2025-06-02T01:06:41Z,Who is Helping Whom? Analyzing Inter-dependencies to Evaluate   Cooperation in Human-AI Teaming,Wer hilft wem? Analysieren von Interdependenzen zur Evaluierung der Zusammenarbeit im Mensch-KI-Teaming,分析评价人类-AI团队合作的相互依存关系,http://arxiv.org/abs/2502.06976v2
41,"Data standardization is a crucial part of the data science life cycle. While tools like Pandas offer robust functionalities, their complexity and the manual effort required for customizing code to diverse column types pose significant challenges. Although large language models (LLMs) like ChatGPT have shown promise in automating this process through natural language understanding and code generation, it still demands expert-level programming knowledge and continuous interaction for prompt refinement. To solve these challenges, our key idea is to propose a Python library with declarative, unified APIs for standardizing different column types, simplifying the LLM's code generation with concise API calls. We first propose Dataprep.Clean, a component of the Dataprep Python Library, significantly reduces the coding complexity by enabling the standardization of specific column types with a single line of code. Then, we introduce the CleanAgent framework integrating Dataprep.Clean and LLM-based agents to automate the data standardization process. With CleanAgent, data scientists only need to provide their requirements once, allowing for a hands-free process. To demonstrate the practical utility of CleanAgent, we developed a user-friendly web application, allowing users to interact with it using real-world datasets.","数据标准化是数据科学生命周期的一个关键部分。虽然像熊猫这样的工具提供了强大的功能,但其复杂性和为定制不同柱型代码所需的手工工作带来了巨大的挑战。虽然像查特格伯特这样的大型语言模型(LLMs)在通过自然语言理解和代码生成实现这一进程自动化方面显示了希望,但它仍然要求专家级编程知识和持续互动,以便迅速完善。为了应对这些挑战,我们的关键想法是提出一个配有声明性、统一的单体标准化信息源的Python图书馆,用于规范不同柱型的标准化,简化LLM的代码生成,并使用简洁的API电话。我们首先提议Dataprep.Clean,这是Dataprep Python图书馆的一个组件,通过允许单行代码中特定柱型条目的标准化,大大降低了编码的复杂度。然后,我们引入了将 Dataprep.Clean和LLM 代理器整合数据标准化进程的清洁化框架。有了清洁的科学家,只需要一次提供其要求,从而可以进行手动程序。为了展示CleAgentient,我们开发了一个方便用户的网络应用。","Danrui Qi, Zhengjie Miao, Jiannan Wang",2025-06-02T00:45:04Z,CleanAgent: Automating Data Standardization with LLM-based Agents,CleanAgent: Automatisierung der Datenstandardisierung mit LLM-basierten Agenten,清洁剂:与LLM代理商实现数据标准化自动化,http://arxiv.org/abs/2403.08291v4
42,"Existing work on the alignment problem has focused mainly on (1) qualitative descriptions of the alignment problem; (2) attempting to align AI actions with human interests by focusing on value specification and learning; and/or (3) focusing on a single agent or on humanity as a monolith. Recent sociotechnical approaches highlight the need to understand complex misalignment among multiple human and AI agents. We address this gap by adapting a computational social science model of human contention to the alignment problem. Our model quantifies misalignment in large, diverse agent groups with potentially conflicting goals across various problem areas. Misalignment scores in our framework depend on the observed agent population, the domain in question, and conflict between agents' weighted preferences. Through simulations, we demonstrate how our model captures intuitive aspects of misalignment across different scenarios. We then apply our model to two case studies, including an autonomous vehicle setting, showcasing its practical utility. Our approach offers enhanced explanatory power for complex sociotechnical environments and could inform the design of more aligned AI systems in real-world applications.","关于调整问题的现有工作主要侧重于:(1) 对调整问题进行定性描述;(2) 试图通过注重价值规格和学习,使大赦国际的行动与人类利益保持一致;和/或(3) 侧重于单一的代理人或将人类作为单一体;最近的社会技术方法强调需要理解多种人类和大赦国际代理人之间复杂的不协调问题;我们通过将人类争论的计算社会科学模型与调整问题相适应来弥补这一差距;我们的模型量化了大型、多样化的代理人群体在各种问题领域的目标可能相互冲突时的不匹配。我们框架中的错配分取决于所观察到的代理人人口、所涉领域以及代理人的加权偏好之间的冲突。我们通过模拟,展示我们的模型如何捕捉到不同情景之间不协调的直观方面。我们然后将我们的模型应用于两个案例研究,包括自主的车辆设置,展示其实际效用。我们的方法为复杂的社会技术环境提供了更强的解释力,并为设计现实世界应用中更加一致的AI系统提供了参考。","Aidan Kierans, Avijit Ghosh, Hananel Hazan, Shiri Dori-Hacohen",2025-06-01T17:41:48Z,Quantifying Misalignment Between Agents: Towards a Sociotechnical   Understanding of Alignment,Quantifizierung der Fehlausrichtung zwischen Agenten: Auf dem Weg zu einem soziotechnischen Verständnis der Ausrichtung,量化代理人之间的不匹配:争取从社会技术上理解协调问题,http://arxiv.org/abs/2406.04231v4
43,"Rapid Large Language Model (LLM) advancements are fueling autonomous Multi-Agent System (MAS) development. However, current frameworks often lack flexibility, resource awareness, model diversity, and autonomous tool creation. This paper introduces HASHIRU (Hierarchical Agent System for Hybrid Intelligent Resource Utilization), a novel MAS framework enhancing flexibility, resource efficiency, and adaptability. HASHIRU features a ""CEO"" agent dynamically managing specialized ""employee"" agents, instantiated based on task needs and resource constraints (cost, memory). Its hybrid intelligence prioritizes smaller, local LLMs (via Ollama) while flexibly using external APIs and larger models when necessary. An economic model with hiring/firing costs promotes team stability and efficient resource allocation. The system also includes autonomous API tool creation and a memory function. Evaluations on tasks like academic paper review (58% success), safety assessments (100% on a JailbreakBench subset), and complex reasoning (outperforming Gemini 2.0 Flash on GSM8K: 96% vs. 61%; JEEBench: 80% vs. 68.3%; SVAMP: 92% vs. 84%) demonstrate HASHIRU's capabilities. Case studies illustrate its self-improvement via autonomous cost model generation, tool integration, and budget management. HASHIRU offers a promising approach for more robust, efficient, and adaptable MAS through dynamic hierarchical control, resource-aware hybrid intelligence, and autonomous functional extension. Source code and benchmarks are available at https://github.com/HASHIRU-AI/HASHIRU and https://github.com/HASHIRU-AI/HASHIRUBench respectively, and a live demo is available at https://hashiruagentx-hashiruai.hf.space upon request.","快速大语言模型(LLM)的进步正在推动自主的多机构系统(MAS)的开发。然而,当前的框架往往缺乏灵活性、资源意识、模式多样性和自主工具创建。本文介绍了HASHIRU(混合智能资源利用高级代理系统),这是一个创新的MAS框架,提高了灵活性、资源效率和适应性。HSHIRU有一个“CE”代理机构,根据任务需要和资源限制(成本、记忆)即时管理专门的“雇员”代理机构。它的混合情报优先考虑的是较小、本地LMS(通过Ollama),同时在必要时使用外部API和更大的智能模型。一个雇用/firing成本促进团队稳定和高效资源分配的经济模型。这个系统还包括自主的API工具创建和记忆功能。对学术文件审查(58%的成功)、安全评估(在Jilbreak Benchench分集中100%),以及复杂的推理(GSMO8K:96% 和RURURR-RU 分别用于GSU 和61%;JEB:80% Vs 模式:68.3%;SAIS-harmax-ral-ral-ral-ral-ral Restal Restal Restal ex) ex ex ex areal ex ex ex ex ex ex destyalmailmal ex ex ex ex ex ex ex ex ex ex ex a.","Kunal Pai, Parth Shah, Harshil Patel",2025-06-01T17:33:16Z,HASHIRU: Hierarchical Agent System for Hybrid Intelligent Resource   Utilization,HASHIRU: Hierarchisches Agentensystem für hybride intelligente Ressourcennutzung,HHHHIRU:混合智能资源利用等级代理系统,http://arxiv.org/abs/2506.04255v1
