,abstract,authors,date,title,title-de,title-zh,url
30,"Neural network minima are often connected by curves along which train and test loss remain nearly constant, a phenomenon known as mode connectivity. While this property has enabled applications such as model merging and fine-tuning, its theoretical explanation remains unclear. We propose a new approach to exploring the connectedness of minima using parameter space symmetry. By linking the topology of symmetry groups to that of the minima, we derive the number of connected components of the minima of linear networks and show that skip connections reduce this number. We then examine when mode connectivity and linear mode connectivity hold or fail, using parameter symmetries which account for a significant part of the minimum. Finally, we provide explicit expressions for connecting curves in the minima induced by symmetry. Using the curvature of these curves, we derive conditions under which linear mode connectivity approximately holds. Our findings highlight the role of continuous symmetries in understanding the neural network loss landscape.","Bo Zhao, Nima Dehmamy, Robin Walters, Rose Yu",2025-05-29T17:20:54Z,Understanding Mode Connectivity via Parameter Space Symmetry,Mode-Konnektivität über Parameter Raumsymmetrie verstehen,通过参数空间对称法理解模式连通性,http://arxiv.org/abs/2505.23681v1
31,"Robust routing under uncertainty is central to real-world logistics, yet most benchmarks assume static, idealized settings. We present SVRPBench, the first open benchmark to capture high-fidelity stochastic dynamics in vehicle routing at urban scale. Spanning more than 500 instances with up to 1000 customers, it simulates realistic delivery conditions: time-dependent congestion, log-normal delays, probabilistic accidents, and empirically grounded time windows for residential and commercial clients. Our pipeline generates diverse, constraint-rich scenarios, including multi-depot and multi-vehicle setups. Benchmarking reveals that state-of-the-art RL solvers like POMO and AM degrade by over 20% under distributional shift, while classical and metaheuristic methods remain robust. To enable reproducible research, we release the dataset and evaluation suite. SVRPBench challenges the community to design solvers that generalize beyond synthetic assumptions and adapt to real-world uncertainty.","Ahmed Heakl, Yahia Salaheldin Shaaban, Martin Takac, Salem Lahlou, Zangir Iklassov",2025-05-29T17:17:47Z,SVRPBench: A Realistic Benchmark for Stochastic Vehicle Routing Problem,SVRPBench: Ein realistischer Maßstab für stochastisches Fahrzeugrouting-Problem,SVRPBench: 蒸汽车辆流出问题的现实基准,http://arxiv.org/abs/2505.21887v2
32,"Bayesian optimization (BO) with preference-based feedback has recently garnered significant attention due to its emerging applications. We refer to this problem as Bayesian Optimization from Human Feedback (BOHF), which differs from conventional BO by learning the best actions from a reduced feedback model, where only the preference between two actions is revealed to the learner at each time step. The objective is to identify the best action using a limited number of preference queries, typically obtained through costly human feedback. Existing work, which adopts the Bradley-Terry-Luce (BTL) feedback model, provides regret bounds for the performance of several algorithms. In this work, within the same framework we develop tighter performance guarantees. Specifically, we derive regret bounds of $\tilde{\mathcal{O}}(\sqrt{\Gamma(T)T})$, where $\Gamma(T)$ represents the maximum information gain$\unicode{x2014}$a kernel-specific complexity term$\unicode{x2014}$and $T$ is the number of queries. Our results significantly improve upon existing bounds. Notably, for common kernels, we show that the order-optimal sample complexities of conventional BO$\unicode{x2014}$achieved with richer feedback models$\unicode{x2014}$are recovered. In other words, the same number of preferential samples as scalar-valued samples is sufficient to find a nearly optimal solution.","Aya Kayal, Sattar Vakili, Laura Toni, Da-shan Shiu, Alberto Bernacchia",2025-05-29T17:17:29Z,Bayesian Optimization from Human Feedback: Near-Optimal Regret Bounds,Bayesische Optimierung durch menschliches Feedback: Nah-optimale Reue-Bounds,Bayesian 人体反馈的优化:接近最佳的冷却环,http://arxiv.org/abs/2505.23673v1
33,"Developing high-performance software is a complex task that requires specialized expertise. We introduce GSO, a benchmark for evaluating language models' capabilities in developing high-performance software. We develop an automated pipeline that generates and executes performance tests to analyze repository commit histories to identify 102 challenging optimization tasks across 10 codebases, spanning diverse domains and programming languages. An agent is provided with a codebase and performance test as a precise specification, and tasked to improve the runtime efficiency, which is measured against the expert developer optimization. Our quantitative evaluation reveals that leading SWE-Agents struggle significantly, achieving less than 5% success rate, with limited improvements even with inference-time scaling. Our qualitative analysis identifies key failure modes, including difficulties with low-level languages, practicing lazy optimization strategies, and challenges in accurately localizing bottlenecks. We release the code and artifacts of our benchmark along with agent trajectories to enable future research.","Manish Shetty, Naman Jain, Jinjian Liu, Vijay Kethanaboyina, Koushik Sen, Ion Stoica",2025-05-29T17:14:55Z,GSO: Challenging Software Optimization Tasks for Evaluating SWE-Agents,GSO: Herausfordernde Software-Optimierungsaufgaben zur Bewertung von SWE-Agenten,GSO:评估SWE-Agentics的有挑战的软件优化任务,http://arxiv.org/abs/2505.23671v1
34,"Reinforcement learning (RL) has enabled machine learning models to achieve significant advances in many fields. Most recently, RL has empowered frontier language models to solve challenging math, science, and coding problems. However, central to any RL algorithm is the reward function, and reward engineering is a notoriously difficult problem in any domain. In this paper, we propose RENT: Reinforcement Learning via Entropy Minimization -- a fully unsupervised RL method that requires no external reward or ground-truth answers, and instead uses the model's entropy of its underlying distribution as an intrinsic reward. We find that by reinforcing the chains of thought that yield high model confidence on its generated answers, the model improves its reasoning ability. In our experiments, we showcase these improvements on an extensive suite of commonly-used reasoning benchmarks, including GSM8K, MATH500, AMC, AIME, and GPQA, and models of varying sizes from the Qwen and Mistral families. The generality of our unsupervised learning method lends itself to applicability in a wide range of domains where external supervision is unavailable.","Mihir Prabhudesai, Lili Chen, Alex Ippoliti, Katerina Fragkiadaki, Hao Liu, Deepak Pathak",2025-05-29T17:14:34Z,Maximizing Confidence Alone Improves Reasoning,Maximierung des Vertrauens allein verbessert die Vernunft,使信心最大化单独提高合理性,http://arxiv.org/abs/2505.22660v2
35,"Conventional model compression techniques for LLMs address high memory consumption and slow inference challenges but typically require computationally expensive retraining to preserve accuracy. In contrast, one-shot compression methods eliminate retraining cost, but struggle to achieve accuracy comparable to dense models. This paper presents SLIM, a new one-shot compression framework that holistically integrates hardware-friendly quantization, sparsity, and low-rank approximation into a unified process. First, we formulate the quantization process using a probabilistic approach (SLIM-Quant) that enables us to apply uniform quantization. Then, we use an existing one-shot pruning method to apply semi-structured sparsity on top of the quantized weights. Finally, to compensate for the introduced aggregated quantization and sparsity error, we use a novel saliency function with unique invertible and additive features that enables us to mathematically compute the value of low-rank adapters. SLIM improves model accuracy by up to 5.66% (LLaMA-2-7B) for 2:4 sparsity with 4-bit weight quantization, outperforming prior methods. Models compressed with SLIM achieve up to 4.3x and 3.8x on Nvidia RTX3060 and A100 GPUs, respectively. Additionally, they achieve up to 0.23x end-to-end memory reduction in comparison to their dense counterparts. We also propose an optional PEFT recipe that further improves accuracy by up to 1.66% (LLaMA-2-13B) compared to SLIM without fine-tuning.","Mohammad Mozaffari, Amir Yazdanbakhsh, Maryam Mehri Dehnavi",2025-05-29T17:14:16Z,SLiM: One-shot Quantization and Sparsity with Low-rank Approximation for   LLM Weight Compression,SLiM: Ein-Schuss-Quantisierung und Sparsamkeit mit Low-Rank-Annäherung für LLM-Gewichtskompression,SLiM: LLM 重量压缩的单射量和与低级别近似相近的分数,http://arxiv.org/abs/2410.09615v3
36,"Transformer-based large language models suffer from quadratic complexity at inference on long sequences. Linear attention methods are efficient alternatives, however, they fail to provide an accurate approximation of softmax attention. By additionally incorporating sliding window attention into each linear attention head, this gap can be closed for short context-length tasks. Unfortunately, these approaches cannot recall important information from long contexts due to ""memory collisions"". In this paper , we propose LoLA: Low-rank Linear Attention with sparse caching. LoLA separately stores additional key-value pairs that would otherwise interfere with past associative memories. Moreover, LoLA further closes the gap between linear attention models and transformers by distributing past key-value pairs into three forms of memory: (i) recent pairs in a local sliding window; (ii) difficult-to-memorize pairs in a sparse, global cache; and (iii) generic pairs in the recurrent hidden state of linear attention. As an inference-only strategy, LoLA enables pass-key retrieval on up to 8K context lengths on needle-in-a-haystack tasks from RULER. It boosts the accuracy of the base subquadratic model from 0.6% to 97.4% at 4K context lengths, with a 4.6x smaller cache than that of Llama-3.1 8B. LoLA demonstrates strong performance on zero-shot commonsense reasoning tasks among 1B and 8B parameter subquadratic models. Finally, LoLA is an extremely lightweight approach: Nearly all of our results can be reproduced on a single consumer GPU.","Luke McDermott, Robert W. Heath Jr., Rahul Parhi",2025-05-29T17:12:42Z,LoLA: Low-Rank Linear Attention With Sparse Caching,LoLA: Low-Rank Lineare Aufmerksamkeit mit Sparse Caching,"LoLA: 低兰克线性注意, 以粗糙的缓存",http://arxiv.org/abs/2505.23666v1
37,"The cost and accuracy of simulating complex physical systems using the Finite Element Method (FEM) scales with the resolution of the underlying mesh. Adaptive meshes improve computational efficiency by refining resolution in critical regions, but typically require task-specific heuristics or cumbersome manual design by a human expert. We propose Adaptive Meshing By Expert Reconstruction (AMBER), a supervised learning approach to mesh adaptation. Starting from a coarse mesh, AMBER iteratively predicts the sizing field, i.e., a function mapping from the geometry to the local element size of the target mesh, and uses this prediction to produce a new intermediate mesh using an out-of-the-box mesh generator. This process is enabled through a hierarchical graph neural network, and relies on data augmentation by automatically projecting expert labels onto AMBER-generated data during training. We evaluate AMBER on 2D and 3D datasets, including classical physics problems, mechanical components, and real-world industrial designs with human expert meshes. AMBER generalizes to unseen geometries and consistently outperforms multiple recent baselines, including ones using Graph and Convolutional Neural Networks, and Reinforcement Learning-based approaches.","Niklas Freymuth, Tobias Würth, Nicolas Schreiber, Balazs Gyenes, Andreas Boltres, Johannes Mitsch, Aleksandar Taranovic, Tai Hoang, Philipp Dahlinger, Philipp Becker, Luise Kärger, Gerhard Neumann",2025-05-29T17:10:44Z,AMBER: Adaptive Mesh Generation by Iterative Mesh Resolution Prediction,AMBER: Adaptive Mesh-Generierung durch iterative Mesh-Auflösungsvorhersage,以迭代网目分辨率预测的适应性代谢代谢,http://arxiv.org/abs/2505.23663v1
38,"We introduce a new Bayesian perspective on the concept of data reconstruction, and leverage this viewpoint to propose a new security definition that, in certain settings, provably prevents reconstruction attacks. We use our paradigm to shed new light on one of the most notorious attacks in the privacy and memorization literature - fingerprinting code attacks (FPC). We argue that these attacks are really a form of membership inference attacks, rather than reconstruction attacks. Furthermore, we show that if the goal is solely to prevent reconstruction (but not membership inference), then in some cases the impossibility results derived from FPC no longer apply.","Haim Kaplan, Yishay Mansour, Kobbi Nissim, Uri Stemmer",2025-05-29T17:08:19Z,Bayesian Perspective on Memorization and Reconstruction,Bayesische Perspektive auf Erinnerung und Wiederaufbau,Bayes人对记忆和重建的看法,http://arxiv.org/abs/2505.23658v1
39,"Recent decoding methods improve the factuality of large language models~(LLMs) by refining how the next token is selected during generation. These methods typically operate at the token level, leveraging internal representations to suppress superficial patterns. Nevertheless, LLMs remain prone to hallucinations, especially over longer contexts. In this paper, we propose Active Layer-Contrastive Decoding (ActLCD), a novel decoding strategy that actively decides when to apply contrasting layers during generation. By casting decoding as a sequential decision-making problem, ActLCD employs a reinforcement learning policy guided by a reward-aware classifier to optimize factuality beyond the token level. Our experiments demonstrate that ActLCD surpasses state-of-the-art methods across five benchmarks, showcasing its effectiveness in mitigating hallucinations in diverse generation scenarios.","Hongxiang Zhang, Hao Chen, Tianyi Zhang, Muhao Chen",2025-05-29T17:07:24Z,Active Layer-Contrastive Decoding Reduces Hallucination in Large   Language Model Generation,Aktives Layer-Kontrastives Decodieren reduziert Halluzination bei der Generierung von Großsprachenmodellen,大型语言模式生成中活性多语言解层解码减少幻觉,http://arxiv.org/abs/2505.23657v1
40,"Recent work suggests that large language models (LLMs) can perform multi-hop reasoning implicitly -- producing correct answers without explicitly verbalizing intermediate steps -- but the underlying mechanisms remain poorly understood. In this paper, we study how such implicit reasoning emerges by training transformers from scratch in a controlled symbolic environment. Our analysis reveals a three-stage developmental trajectory: early memorization, followed by in-distribution generalization, and eventually cross-distribution generalization. We find that training with atomic triples is not necessary but accelerates learning, and that second-hop generalization relies on query-level exposure to specific compositional structures. To interpret these behaviors, we introduce two diagnostic tools: cross-query semantic patching, which identifies semantically reusable intermediate representations, and a cosine-based representational lens, which reveals that successful reasoning correlates with the cosine-base clustering in hidden space. This clustering phenomenon in turn provides a coherent explanation for the behavioral dynamics observed across training, linking representational structure to reasoning capability. These findings provide new insights into the interpretability of implicit multi-hop reasoning in LLMs, helping to clarify how complex reasoning processes unfold internally and offering pathways to enhance the transparency of such models.","Jiaran Ye, Zijun Yao, Zhidian Huang, Liangming Pan, Jinxin Liu, Yushi Bai, Amy Xin, Liu Weichuan, Xiaoyin Che, Lei Hou, Juanzi Li",2025-05-29T17:02:49Z,How does Transformer Learn Implicit Reasoning?,Wie lernt Transformer Implizite Vernunft?,变形者如何学习隐含理由?,http://arxiv.org/abs/2505.23653v1
41,"Diffusion models have emerged as a powerful framework in generative modeling, typically relying on optimizing neural networks to estimate the score function via forward SDE simulations. In this work, we propose an alternative method that is both optimization-free and forward SDE-free. By expanding the score function in a sparse set of eigenbasis of the backward Kolmogorov operator associated with the diffusion process, we reformulate score estimation as the solution to a linear system, avoiding iterative optimization and time-dependent sample generation. We analyze the approximation error using perturbation theory and demonstrate the effectiveness of our method on high-dimensional Boltzmann distributions and real-world datasets.","Yuehaw Khoo, Mathias Oster, Yifan Peng",2025-05-29T17:02:26Z,Optimization-Free Diffusion Model -- A Perturbation Theory Approach,Optimierungsfreies Diffusionsmodell -- Ein Perturbationstheorie-Ansatz,优化-无优化传播模式 -- -- 扰动理论方法,http://arxiv.org/abs/2505.23652v1
42,"Model merging has emerged as a powerful technique for combining task-specific weights, achieving superior performance in multi-target domain adaptation. However, when applied to practical scenarios, such as quantized models, new challenges arise. In practical scenarios, quantization is often applied to target-specific data, but this process restricts the domain of interest and introduces discretization effects, making model merging highly non-trivial. In this study, we analyze the impact of quantization on model merging through the lens of error barriers. Leveraging these insights, we propose a novel post-training quantization, HDRQ - Hessian and distant regularizing quantization - that is designed to consider model merging for multi-target domain adaptation. Our approach ensures that the quantization process incurs minimal deviation from the source pre-trained model while flattening the loss surface to facilitate smooth model merging. To our knowledge, this is the first study on this challenge, and extensive experiments confirm its effectiveness.","Juncheol Shin, Minsang Seok, Seonggon Kim, Eunhyeok Park",2025-05-29T17:00:56Z,Merge-Friendly Post-Training Quantization for Multi-Target Domain   Adaptation,Merge-Friendly Post-Training Quantization für Multi-Target Domain-Anpassung,多目标域适应培训后量化,http://arxiv.org/abs/2505.23651v1
43,"Constrained Online Convex Optimization (COCO) can be seen as a generalization of the standard Online Convex Optimization (OCO) framework. At each round, a cost function and constraint function are revealed after a learner chooses an action. The goal is to minimize both the regret and cumulative constraint violation (CCV) against an adaptive adversary. We show for the first time that is possible to obtain the optimal $O(\sqrt{T})$ bound on both regret and CCV, improving the best known bounds of $O \left( \sqrt{T} \right)$ and $\tilde{O} \left( \sqrt{T} \right)$ for the regret and CCV, respectively. Based on a new surrogate loss function enforcing a minimum penalty on the constraint function, we demonstrate that both the Follow-the-Regularized-Leader and the Online Gradient Descent achieve the optimal bounds.","Ricardo N. Ferreira, Cláudia Soares",2025-05-29T16:59:14Z,Optimal Bounds for Adversarial Constrained Online Convex Optimization,Optimale Grenzen für die Online-Konvergenzoptimierung,优化在线电传优化优化,http://arxiv.org/abs/2503.13366v4
44,"Current language models generate chain-of-thought traces by autoregressively sampling tokens from a finite vocabulary. While this discrete sampling has achieved remarkable success, conducting chain-of-thought with continuously-valued tokens (CoT2) offers a richer and more expressive alternative. Our work examines the benefits of CoT2 through logical reasoning tasks that inherently require search capabilities and provide optimization and exploration methods for CoT2. Theoretically, we show that CoT2 allows the model to track multiple traces in parallel and quantify its benefits for inference efficiency. Notably, one layer transformer equipped with CoT2 can provably solve the combinatorial ""subset sum problem"" given sufficient embedding dimension. These insights lead to a novel and effective supervision strategy where we match the softmax outputs to the empirical token distributions of a set of target traces. Complementing this, we introduce sampling strategies that unlock policy optimization and self-improvement for CoT2. Our first strategy samples and composes $K$ discrete tokens at each decoding step to control the level of parallelism, and reduces to standard CoT when $K=1$. Our second strategy relies on continuous exploration over the probability simplex. Experiments confirm that policy optimization with CoT2 indeed improves the performance of the model beyond its initial discrete or continuous supervision.","Halil Alperen Gozeten, M. Emrullah Ildiz, Xuechen Zhang, Hrayr Harutyunyan, Ankit Singh Rawat, Samet Oymak",2025-05-29T16:58:28Z,Continuous Chain of Thought Enables Parallel Exploration and Reasoning,Kontinuierliche Gedankenkette ermöglicht parallele Erkundung und Vernunft,连续思考链有助于平行探索和推理,http://arxiv.org/abs/2505.23648v1
45,"Recently evolved large reasoning models (LRMs) show powerful performance in solving complex tasks with long chain-of-thought (CoT) reasoning capability. As these LRMs are mostly developed by post-training on formal reasoning tasks, whether they generalize the reasoning capability to help reduce hallucination in fact-seeking tasks remains unclear and debated. For instance, DeepSeek-R1 reports increased performance on SimpleQA, a fact-seeking benchmark, while OpenAI-o3 observes even severer hallucination. This discrepancy naturally raises the following research question: Are reasoning models more prone to hallucination? This paper addresses the question from three perspectives. (1) We first conduct a holistic evaluation for the hallucination in LRMs. Our analysis reveals that LRMs undergo a full post-training pipeline with cold start supervised fine-tuning (SFT) and verifiable reward RL generally alleviate their hallucination. In contrast, both distillation alone and RL training without cold start fine-tuning introduce more nuanced hallucinations. (2) To explore why different post-training pipelines alters the impact on hallucination in LRMs, we conduct behavior analysis. We characterize two critical cognitive behaviors that directly affect the factuality of a LRM: Flaw Repetition, where the surface-level reasoning attempts repeatedly follow the same underlying flawed logic, and Think-Answer Mismatch, where the final answer fails to faithfully match the previous CoT process. (3) Further, we investigate the mechanism behind the hallucination of LRMs from the perspective of model uncertainty. We find that increased hallucination of LRMs is usually associated with the misalignment between model uncertainty and factual accuracy. Our work provides an initial understanding of the hallucination in LRMs.","Zijun Yao, Yantao Liu, Yanxu Chen, Jianhui Chen, Junfeng Fang, Lei Hou, Juanzi Li, Tat-Seng Chua",2025-05-29T16:53:41Z,Are Reasoning Models More Prone to Hallucination?,Sind vernünftigere Modelle eher halluzinierend?,理性模型更能让人产生幻觉吗?,http://arxiv.org/abs/2505.23646v1
