,abstract,authors,date,title,title-de,title-zh,url
0,"Conversational agents powered by large language models (LLMs) are rapidly becoming integral to our daily interactions, generating unprecedented amounts of conversational data. Such datasets offer a powerful lens into societal interests, trending topics, and collective concerns. Yet, existing approaches typically treat these interactions as independent and miss critical insights that could emerge from aggregating and reasoning across large-scale conversation logs. In this paper, we introduce Aggregative Question Answering, a novel task requiring models to reason explicitly over thousands of user-chatbot interactions to answer aggregative queries, such as identifying emerging concerns among specific demographics. To enable research in this direction, we construct a benchmark, WildChat-AQA, comprising 6,027 aggregative questions derived from 182,330 real-world chatbot conversations. Experiments show that existing methods either struggle to reason effectively or incur prohibitive computational costs, underscoring the need for new approaches capable of extracting collective insights from large-scale conversational data.","Wentao Zhang, Woojeong Kim, Yuntian Deng",2025-05-29T17:59:55Z,From Chat Logs to Collective Insights: Aggregative Question Answering,Von Chat Logs zu Collective Insights: Aggregative Question Answering,从聊天日志到集体透视:聚合问题解答,http://arxiv.org/abs/2505.23765v1
1,"Direct Preference Optimization (DPO) has become a standard technique for aligning language models with human preferences in a supervised manner. Despite its empirical success, the theoretical justification behind its log-ratio reward parameterization remains incomplete. In this work, we address this gap by utilizing the Differential Information Distribution (DID): a distribution over token sequences that captures the information gained during policy updates. First, we show that when preference labels encode the differential information required to transform a reference policy into a target policy, the log-ratio reward in DPO emerges as the uniquely optimal form for learning the target policy via preference optimization. This result naturally yields a closed-form expression for the optimal sampling distribution over rejected responses. Second, we find that the condition for preferences to encode differential information is fundamentally linked to an implicit assumption regarding log-margin ordered policies-an inductive bias widely used in preference optimization yet previously unrecognized. Finally, by analyzing the entropy of the DID, we characterize how learning low-entropy differential information reinforces the policy distribution, while high-entropy differential information induces a smoothing effect, which explains the log-likelihood displacement phenomenon. We validate our theoretical findings in synthetic experiments and extend them to real-world instruction-following datasets. Our results suggest that learning high-entropy differential information is crucial for general instruction-following, while learning low-entropy differential information benefits knowledge-intensive question answering. Overall, our work presents a unifying perspective on the DPO objective, the structure of preference data, and resulting policy behaviors through the lens of differential information.","Yunjae Won, Hyunji Lee, Hyeonbin Hwang, Minjoon Seo",2025-05-29T17:59:50Z,Differential Information: An Information-Theoretic Perspective on   Preference Optimization,Differentialinformation: Eine informationstheoretische Perspektive zur Preference-Optimierung,差别信息:关于首选优化的信息理论观点,http://arxiv.org/abs/2505.23761v1
2,"Model immunization aims to pre-train models that are difficult to fine-tune on harmful tasks while retaining their utility on other non-harmful tasks. Though prior work has shown empirical evidence for immunizing text-to-image models, the key understanding of when immunization is possible and a precise definition of an immunized model remain unclear. In this work, we propose a framework, based on the condition number of a Hessian matrix, to analyze model immunization for linear models. Building on this framework, we design an algorithm with regularization terms to control the resulting condition numbers after pre-training. Empirical results on linear models and non-linear deep-nets demonstrate the effectiveness of the proposed algorithm on model immunization. The code is available at https://github.com/amberyzheng/model-immunization-cond-num.","Amber Yijia Zheng, Cedar Site Bai, Brian Bullins, Raymond A. Yeh",2025-05-29T17:59:48Z,Model Immunization from a Condition Number Perspective,Modell Immunisierung aus einem Zustand Anzahl Perspektive,从条件数字角度进行示范免疫,http://arxiv.org/abs/2505.23760v1
3,"Rebus puzzles, visual riddles that encode language through imagery, spatial arrangement, and symbolic substitution, pose a unique challenge to current vision-language models (VLMs). Unlike traditional image captioning or question answering tasks, rebus solving requires multi-modal abstraction, symbolic reasoning, and a grasp of cultural, phonetic and linguistic puns. In this paper, we investigate the capacity of contemporary VLMs to interpret and solve rebus puzzles by constructing a hand-generated and annotated benchmark of diverse English-language rebus puzzles, ranging from simple pictographic substitutions to spatially-dependent cues (""head"" over ""heels""). We analyze how different VLMs perform, and our findings reveal that while VLMs exhibit some surprising capabilities in decoding simple visual clues, they struggle significantly with tasks requiring abstract reasoning, lateral thinking, and understanding visual metaphors.","Heekyung Lee, Jiaxin Ge, Tsung-Han Wu, Minwoo Kang, Trevor Darrell, David M. Chan",2025-05-29T17:59:47Z,Puzzled by Puzzles: When Vision-Language Models Can't Take a Hint,Puzzlet von Puzzles: Wenn Vision-Language-Modelle keinen Hinweis aufnehmen können,由谜题拼取的谜题: 当视觉语言模型无法使用提示时,http://arxiv.org/abs/2505.23759v1
4,"Sequence models such as transformers require inputs to be represented as one-dimensional sequences. In vision, this typically involves flattening images using a fixed row-major (raster-scan) order. While full self-attention is permutation-equivariant, modern long-sequence transformers increasingly rely on architectural approximations that break this invariance and introduce sensitivity to patch ordering. We show that patch order significantly affects model performance in such settings, with simple alternatives like column-major or Hilbert curves yielding notable accuracy shifts. Motivated by this, we propose REOrder, a two-stage framework for discovering task-optimal patch orderings. First, we derive an information-theoretic prior by evaluating the compressibility of various patch sequences. Then, we learn a policy over permutations by optimizing a Plackett-Luce policy using REINFORCE. This approach enables efficient learning in a combinatorial permutation space. REOrder improves top-1 accuracy over row-major ordering on ImageNet-1K by up to 3.01% and Functional Map of the World by 13.35%.","Declan Kutscher, David M. Chan, Yutong Bai, Trevor Darrell, Ritwik Gupta",2025-05-29T17:59:30Z,REOrdering Patches Improves Vision Models,REOrdering Patches verbessert Vision Modelle,重新排列补丁改进愿景模式,http://arxiv.org/abs/2505.23751v1
5,"After pre-training, large language models are aligned with human preferences based on pairwise comparisons. State-of-the-art alignment methods (such as PPO-based RLHF and DPO) are built on the assumption of aligning with a single preference model, despite being deployed in settings where users have diverse preferences. As a result, it is not even clear that these alignment methods produce models that satisfy users on average -- a minimal requirement for pluralistic alignment. Drawing on social choice theory and modeling users' comparisons through individual Bradley-Terry (BT) models, we introduce an alignment method's distortion: the worst-case ratio between the optimal achievable average utility, and the average utility of the learned policy.   The notion of distortion helps draw sharp distinctions between alignment methods: Nash Learning from Human Feedback achieves the minimax optimal distortion of $(\frac{1}{2} + o(1)) \cdot \beta$ (for the BT temperature $\beta$), robustly across utility distributions, distributions of comparison pairs, and permissible KL divergences from the reference policy. RLHF and DPO, by contrast, suffer $\geq (1 - o(1)) \cdot \beta$ distortion already without a KL constraint, and $e^{\Omega(\beta)}$ or even unbounded distortion in the full setting, depending on how comparison pairs are sampled.","Paul Gölz, Nika Haghtalab, Kunhe Yang",2025-05-29T17:59:20Z,Distortion of AI Alignment: Does Preference Optimization Optimize for   Preferences?,Verzerrung der AI Alignment: Optimiert Preference Optimization für Preferences?,AI对齐的扭曲:偏好优化是否优化优惠?,http://arxiv.org/abs/2505.23749v1
6,"Recent advancements in Multimodal Large Language Models (MLLMs) have significantly enhanced performance on 2D visual tasks. However, improving their spatial intelligence remains a challenge. Existing 3D MLLMs always rely on additional 3D or 2.5D data to incorporate spatial awareness, restricting their utility in scenarios with only 2D inputs, such as images or videos. In this paper, we present Spatial-MLLM, a novel framework for visual-based spatial reasoning from purely 2D observations. Unlike conventional video MLLMs which rely on CLIP-based visual encoders optimized for semantic understanding, our key insight is to unleash the strong structure prior from the feed-forward visual geometry foundation model. Specifically, we propose a dual-encoder architecture: a pretrained 2D visual encoder to extract semantic features, and a spatial encoder-initialized from the backbone of the visual geometry model-to extract 3D structure features. A connector then integrates both features into unified visual tokens for enhanced spatial understanding. Furthermore, we propose a space-aware frame sampling strategy at inference time, which selects the spatially informative frames of a video sequence, ensuring that even under limited token length, the model focuses on frames critical for spatial reasoning. Beyond architecture improvements, we construct the Spatial-MLLM-120k dataset and train the model on it using supervised fine-tuning and GRPO. Extensive experiments on various real-world datasets demonstrate that our spatial-MLLM achieves state-of-the-art performance in a wide range of visual-based spatial understanding and reasoning tasks. Project page: https://diankun-wu.github.io/Spatial-MLLM/.","Diankun Wu, Fangfu Liu, Yi-Hsin Hung, Yueqi Duan",2025-05-29T17:59:04Z,Spatial-MLLM: Boosting MLLM Capabilities in Visual-based Spatial   Intelligence,Raum-MLLM: Steigerung der MLLM-Kapazitäten in visueller räumlicher Intelligenz,空间-MLLM:增强以视觉为基础的空间情报中的MLLM能力,http://arxiv.org/abs/2505.23747v1
7,"Vision-Language Models (VLMs) have demonstrated strong capabilities in aligning visual and textual modalities, enabling a wide range of applications in multimodal understanding and generation. While they excel in zero-shot and transfer learning scenarios, VLMs remain susceptible to misclassification, often yielding confident yet incorrect predictions. This limitation poses a significant risk in safety-critical domains, where erroneous predictions can lead to severe consequences. In this work, we introduce TrustVLM, a training-free framework designed to address the critical challenge of estimating when VLM's predictions can be trusted. Motivated by the observed modality gap in VLMs and the insight that certain concepts are more distinctly represented in the image embedding space, we propose a novel confidence-scoring function that leverages this space to improve misclassification detection. We rigorously evaluate our approach across 17 diverse datasets, employing 4 architectures and 2 VLMs, and demonstrate state-of-the-art performance, with improvements of up to 51.87% in AURC, 9.14% in AUROC, and 32.42% in FPR95 compared to existing baselines. By improving the reliability of the model without requiring retraining, TrustVLM paves the way for safer deployment of VLMs in real-world applications. The code will be available at https://github.com/EPFL-IMOS/TrustVLM.","Hao Dong, Moru Liu, Jian Liang, Eleni Chatzi, Olga Fink",2025-05-29T17:59:01Z,To Trust Or Not To Trust Your Vision-Language Model's Prediction,Vertrauen oder nicht Vertrauen in die Vorhersage Ihres Vision-Sprache-Modells,相信或不相信你的视觉语言模型的预测,http://arxiv.org/abs/2505.23745v1
8,"The majority of parameters in neural networks are naturally represented as matrices. However, most commonly used optimizers treat these matrix parameters as flattened vectors during optimization, potentially overlooking their inherent structural properties. Recently, an optimizer called Muon has been proposed, specifically designed to optimize matrix-structured parameters. Extensive empirical evidence shows that Muon can significantly outperform traditional optimizers when training neural networks. Nonetheless, the theoretical understanding of Muon's convergence behavior and the reasons behind its superior performance remain limited. In this work, we present a comprehensive convergence rate analysis of Muon and its comparison with Gradient Descent (GD). We further characterize the conditions under which Muon can outperform GD. Our theoretical results reveal that Muon can benefit from the low-rank and approximate blockwise diagonal structure of Hessian matrices -- phenomena widely observed in practical neural network training. Our experimental results support and corroborate the theoretical findings.","Wei Shen, Ruichuan Huang, Minhui Huang, Cong Shen, Jiawei Zhang",2025-05-29T17:58:01Z,On the Convergence Analysis of Muon,Zur Konvergenzanalyse von Muon,Muon的趋同分析,http://arxiv.org/abs/2505.23737v1
9,"Current emotion-based contrastive language-audio pretraining (CLAP) methods typically learn by na\""ively aligning audio samples with corresponding text prompts. Consequently, this approach fails to capture the ordinal nature of emotions, hindering inter-emotion understanding and often resulting in a wide modality gap between the audio and text embeddings due to insufficient alignment. To handle these drawbacks, we introduce EmotionRankCLAP, a supervised contrastive learning approach that uses dimensional attributes of emotional speech and natural language prompts to jointly capture fine-grained emotion variations and improve cross-modal alignment. Our approach utilizes a Rank-N-Contrast objective to learn ordered relationships by contrasting samples based on their rankings in the valence-arousal space. EmotionRankCLAP outperforms existing emotion-CLAP methods in modeling emotion ordinality across modalities, measured via a cross-modal retrieval task.","Shreeram Suresh Chandra, Lucas Goncalves, Junchen Lu, Carlos Busso, Berrak Sisman",2025-05-29T17:56:55Z,EmotionRankCLAP: Bridging Natural Language Speaking Styles and Ordinal   Speech Emotion via Rank-N-Contrast,EmotionRankCLAP: Bridging Natural Language Speaking Styles und Ordinal Speech Emotion via Rank-N-Contrast,情感-RankCLAP:通过Ran-N-Contrast将自然语言语言语言的口语风格和普通语言的情感联系起来,http://arxiv.org/abs/2505.23732v1
10,"This paper considers a novel variant of the online fair division problem involving multiple agents in which a learner sequentially observes an indivisible item that has to be irrevocably allocated to one of the agents while satisfying a fairness and efficiency constraint. Existing algorithms assume a small number of items with a sufficiently large number of copies, which ensures a good utility estimation for all item-agent pairs from noisy bandit feedback. However, this assumption may not hold in many real-life applications, for example, an online platform that has a large number of users (items) who use the platform's service providers (agents) only a few times (a few copies of items), which makes it difficult to accurately estimate utilities for all item-agent pairs. To address this, we assume utility is an unknown function of item-agent features. We then propose algorithms that model online fair division as a contextual bandit problem, with sub-linear regret guarantees. Our experimental results further validate the effectiveness of the proposed algorithms.","Arun Verma, Indrajit Saha, Makoto Yokoo, Bryan Kian Hsiang Low",2025-05-29T17:56:45Z,Keep Everyone Happy: Online Fair Division of Numerous Items with Few   Copies,Halten Sie alle glücklich: Online Fair Division von zahlreichen Artikeln mit wenigen Kopien,"让人人快乐:许多物品的在线公平分会,只有很少的影印件。",http://arxiv.org/abs/2408.12845v2
11,"DiLoCo is a powerful framework for training large language models (LLMs) under networking constraints with advantages for increasing parallelism and accelerator utilization in data center settings. Despite significantly reducing communication frequency, however, DiLoCo's communication steps still involve all-reducing a complete copy of the model's parameters. While existing works have explored ways to reduce communication in DiLoCo, the role of error feedback accumulators and the effect of the inner-optimizer on compressibility remain under-explored. In this work, we investigate the effectiveness of standard compression methods including Top-k sparsification and quantization for reducing the communication overhead of DiLoCo when paired with two local optimizers (AdamW and Muon). Our experiments pre-training decoder-only transformer language models (LMs) reveal that leveraging Muon as the inner optimizer for DiLoCo along with an error-feedback accumulator allows to aggressively compress the communicated delta to 2-bits with next to no performance degradation. Crucially, MuLoCo (Muon inner optimizer DiLoCo) significantly outperforms DiLoCo while communicating 8X less and having identical memory complexity.","Benjamin Thérien, Xiaolong Huang, Irina Rish, Eugene Belilovsky",2025-05-29T17:55:37Z,MuLoCo: Muon is a practical inner optimizer for DiLoCo,MuLoCo: Muon ist ein praktischer Innenoptimierer für DiLoCo,MuLoCo: Muon 是 DiLoCo 的实用内部优化器,http://arxiv.org/abs/2505.23725v1
12,"Parameter-Efficient Fine-Tuning (PEFT) methods, particularly Low-Rank Adaptation (LoRA), are indispensable for efficiently customizing Large Language Models (LLMs). However, vanilla LoRA suffers from slow convergence speed and knowledge forgetting problems. Recent studies have leveraged the power of designed LoRA initialization, to enhance the fine-tuning efficiency, or to preserve knowledge in the pre-trained LLM. However, none of these works can address the two cases at the same time. To this end, we introduce Subspace-Constrained LoRA (SC-LoRA), a novel LoRA initialization framework engineered to navigate the trade-off between efficient fine-tuning and knowledge preservation. We achieve this by constraining the output of trainable LoRA adapters in a low-rank subspace, where the context information of fine-tuning data is most preserved while the context information of preserved knowledge is least retained, in a balanced way. Such constraint enables the trainable weights to primarily focus on the main features of fine-tuning data while avoiding damaging the preserved knowledge features. We provide theoretical analysis on our method, and conduct extensive experiments including safety preservation and world knowledge preservation, on various downstream tasks. In our experiments, SC-LoRA succeeds in delivering superior fine-tuning performance while markedly diminishing knowledge forgetting, surpassing contemporary LoRA initialization methods.","Minrui Luo, Fuhang Kuang, Yu Wang, Zirui Liu, Tianxing He",2025-05-29T17:55:21Z,SC-LoRA: Balancing Efficient Fine-tuning and Knowledge Preservation via   Subspace-Constrained LoRA,SC-LoRA: Ausbalancieren effizienter Feinsteuerung und Wissenserhaltung über Subraum-kontrainierte LoRA,SC-LORA:通过分空间训练LORA平衡高效微调和知识保护,http://arxiv.org/abs/2505.23724v1
13,"The emergence of large language model (LLM)-based agents has significantly advanced the development of autonomous machine learning (ML) engineering. However, most existing approaches rely heavily on manual prompt engineering, failing to adapt and optimize based on diverse experimental experiences. Focusing on this, for the first time, we explore the paradigm of learning-based agentic ML, where an LLM agent learns through interactive experimentation on ML tasks using online reinforcement learning (RL). To realize this, we propose a novel agentic ML training framework with three key components: (1) exploration-enriched fine-tuning, which enables LLM agents to generate diverse actions for enhanced RL exploration; (2) step-wise RL, which enables training on a single action step, accelerating experience collection and improving training efficiency; (3) an agentic ML-specific reward module, which unifies varied ML feedback signals into consistent rewards for RL optimization. Leveraging this framework, we train ML-Agent, driven by a 7B-sized Qwen-2.5 LLM for autonomous ML. Remarkably, despite being trained on merely 9 ML tasks, our 7B-sized ML-Agent outperforms the 671B-sized DeepSeek-R1 agent. Furthermore, it achieves continuous performance improvements and demonstrates exceptional cross-task generalization capabilities.","Zexi Liu, Jingyi Chai, Xinyu Zhu, Shuo Tang, Rui Ye, Bo Zhang, Lei Bai, Siheng Chen",2025-05-29T17:54:44Z,ML-Agent: Reinforcing LLM Agents for Autonomous Machine Learning   Engineering,ML-Agent: Verstärkung von LLM-Agenten für autonome Maschinenbautechnik,ML-代理:加强自动机械学习工程的LLM代理,http://arxiv.org/abs/2505.23723v1
14,"Machine Learning Force Fields (MLFFs) are a promising alternative to expensive ab initio quantum mechanical molecular simulations. Given the diversity of chemical spaces that are of interest and the cost of generating new data, it is important to understand how MLFFs generalize beyond their training distributions. In order to characterize and better understand distribution shifts in MLFFs, we conduct diagnostic experiments on chemical datasets, revealing common shifts that pose significant challenges, even for large foundation models trained on extensive data. Based on these observations, we hypothesize that current supervised training methods inadequately regularize MLFFs, resulting in overfitting and learning poor representations of out-of-distribution systems. We then propose two new methods as initial steps for mitigating distribution shifts for MLFFs. Our methods focus on test-time refinement strategies that incur minimal computational cost and do not use expensive ab initio reference labels. The first strategy, based on spectral graph theory, modifies the edges of test graphs to align with graph structures seen during training. Our second strategy improves representations for out-of-distribution systems at test-time by taking gradient steps using an auxiliary objective, such as a cheap physical prior. Our test-time refinement strategies significantly reduce errors on out-of-distribution systems, suggesting that MLFFs are capable of and can move towards modeling diverse chemical spaces, but are not being effectively trained to do so. Our experiments establish clear benchmarks for evaluating the generalization capabilities of the next generation of MLFFs. Our code is available at https://tkreiman.github.io/projects/mlff_distribution_shifts/.","Tobias Kreiman, Aditi S. Krishnapriyan",2025-05-29T17:53:47Z,Understanding and Mitigating Distribution Shifts For Machine Learning   Force Fields,Verteilungsverschiebungen für maschinelle Lernkräfte verstehen und abmildern,机器学习领域理解和缩小分布变化,http://arxiv.org/abs/2503.08674v2
